title,score,id,url,comms_num,created,ups,downs,author,body,timestamp
"Everybody in Virginia hates Maryland drivers, everybody in Maryland hates Virginia drivers, and everybody in DC hates all drivers. Come on everybody. We all know which license plates you really should be avoiding",888,4n1ta7,http://i.imgur.com/4ULVkxr.jpg,213,1465368164.0,888,0,bobbogreeno,,2016-06-08 02:42:44
Some early cherry blossom blooming happening near the mall.,878,b2765d,https://i.redd.it/kblkrw1olpm21.jpg,21,1552870354.0,878,0,todd6739,,2019-03-17 20:52:34
My 88-year-old grandfather recently started a blog listing free cultural events in DC. He'd about keel over from joy if it got a little bump in views.,880,1x7cl3,http://www.dcfreeculture.com/,82,1391743850.0,880,0,theturbolemming,,2014-02-06 22:30:50
You know you're in the rough part of Georgetown when you see boat shoes hanging from the power lines,879,c3w2cs,https://i.redd.it/z7fijxf9pz531.jpg,42,1561273740.0,879,0,jewsanon,,2019-06-23 03:09:00
Petition to have the Pope bless the metro system so it actually works,876,3lv18g,https://www.reddit.com/r/washingtondc/comments/3lv18g/petition_to_have_the_pope_bless_the_metro_system/,90,1442902499.0,876,0,kazneus,"At this point I'm willing to try anything

Edit: [I made a thing](https://www.change.org/p/pope-francis-get-the-pope-to-bless-the-dc-metro-system-so-it-actually-works)",2015-09-22 02:14:59
Yesterday I saw a couple at 17th & T,872,ddbqyj,https://www.reddit.com/r/washingtondc/comments/ddbqyj/yesterday_i_saw_a_couple_at_17th_t/,62,1570244320.0,872,0,DistrictCop,"who were walking along the sidewalk when the woman, clearly wincing with each step, mentioned that her high heels were hurting her feet. 

The man missed nary a beat in taking his own shoes off and sliding them over to her, and she eagerly put them on. 

Off they went: the woman, happily plodding along in oversized leather dress shoes, next to a man tiptoeing through the city in his socks, proudly lying that the arrangement was more comfortable for him as well. 

Made me smile. Just thought I'd share it with you all as well.",2019-10-04 22:58:40
🙌 DC was absolutely poppin' yesterday. Thank you MPDC and City of DC for allowing the crowd to continue the party outdoors!,873,8o83of,https://i.redd.it/u1fim682zr111.jpg,55,1528056270.0,873,0,Devastator1981,,2018-06-03 16:04:30
"I am not totally sure why, but I feel compelled to share this shot of my son at the kite fest from a few months ago. Happy Friday!",874,cl6bhj,https://i.redd.it/1dhbg952a2e31.jpg,30,1564791859.0,874,0,guy_in_a_knit_hat,,2019-08-02 20:24:19
My roommate sent this in our group text today,878,446b54,http://imgur.com/XVwlFGC,44,1454635968.0,878,0,paintedcones,,2016-02-04 20:32:48
The Metro escalators in The Division 2,870,aogi9i,https://i.redd.it/k86s1d0bjcf21.jpg,111,1549661290.0,870,0,Falldog,,2019-02-08 16:28:10
Can we get every escalator in the world painted like this please?,871,ab2evv,https://i.redd.it/txg6py3ngi721.jpg,64,1546249959.0,871,0,abeeko,,2018-12-31 04:52:39
Cloud hanging over DC this morning,872,8cnfzo,https://i.redd.it/ae4dqvpvt9s01.jpg,37,1523913488.0,872,0,The_Business__End,,2018-04-16 17:18:08
An unlikely duo on M Street NE!,864,bsn2tz,https://v.redd.it/s6826oytg8031,32,1558764821.0,864,0,DistrictCop,,2019-05-25 02:13:41
Marchers overwhelmed the NPS. We did not have a permit to be on the mall. We ended up there because there were too damn many of us. Let's make it right.,864,5pop8k,https://www.nationalparks.org/support,67,1485207039.0,864,0,scarrie,,2017-01-23 16:30:39
"Canal Road at Fletcher's Cove this morning, taken by WTOP's Dave Dildine. Turn around, don't drown!",864,cal4av,https://i.redd.it/vzvuljgm13931.jpg,127,1562621802.0,864,0,wtopnews,,2019-07-08 17:36:42
I originally posted this on r/pics but someone suggested I post it here. Hopefully it went well with whoever wrote this.,862,abik3f,https://i.redd.it/ewfsadevnt721.jpg,44,1546381797.0,862,0,ho_riene,,2019-01-01 17:29:57
"If this is your car, the license plate of the guy who hit you and drove off is in the comments here. Good luck with the damage.",863,cmhb0x,https://i.redd.it/fegbxozl7pe31.jpg,110,1565069452.0,863,0,Glockshna,,2019-08-06 01:30:52
THIS IS A SEVEN THOUSAND SERIES DRAIN,854,caqiaa,https://twitter.com/JoshuaJMarks/status/1148302165561282561,46,1562646735.0,854,0,veepeedeepee,,2019-07-09 00:32:15
"Driving through Rock Creek Park yesterday was not a good idea, but I shot this before turning around!",860,at42db,https://i.redd.it/jzlxb0mfrxh21.jpg,16,1550789925.0,860,0,howlermouse,,2019-02-21 17:58:45
Snow covered magnolias at the Capitol,858,86f5vl,https://i.redd.it/75f8deb8sdn01.jpg,22,1521782186.0,858,0,zackowicz,,2018-03-23 01:16:26
"My sister, a longtime lurker of this sub, requested that I post her love for OPM.",850,assv8j,https://i.redd.it/iyolhh143sh21.jpg,37,1550721335.0,850,0,ClasslessHero,,2019-02-20 22:55:35
"CNN reporter confirms that José Andrés, not Trump, is scheduled to throw the first pitch for game five of the World Series.",853,dmw4ry,https://twitter.com/jdiamond1/status/1187672988939894785?s=21,143,1572031896.0,853,0,SQUEEEEEEEEEPS,,2019-10-25 15:31:36
Cherry blossoms🌸🌸,850,b9is4t,https://i.redd.it/yosx9w2fhbq21.jpg,14,1554442819.0,850,0,RD_2411,,2019-04-05 01:40:19
Projected on the FCC [X-post from r/pics],849,7jjzr4,https://i.imgur.com/SAg12u1.png,49,1513208009.0,849,0,KanderBear,,2017-12-13 18:33:29
Last night at 10:56pm we counted down (like New Years) as a giant boot touched down at the Air & Space Museum,851,cfzrdr,https://i.redd.it/2ptteiz86ob31.jpg,9,1563749281.0,851,0,ageowns,,2019-07-21 18:48:01
Shot some film in DC last week and captured this true Bromance.,845,atw6kh,https://imgur.com/ZCFX1qG,46,1550962087.0,845,0,Phd_Perky,,2019-02-23 17:48:07
"People who come to a dead stop immediately after getting off a metro escalator, what’s your plan here?",842,axl2tk,https://www.reddit.com/r/washingtondc/comments/axl2tk/people_who_come_to_a_dead_stop_immediately_after/,105,1551820805.0,842,0,monstercello,"I mean seriously people, it’s not that hard",2019-03-05 16:20:05
Projection at 14th and S NW,844,96mogg,https://i.imgur.com/smi6f3b.jpg,34,1534076528.0,844,0,1181,,2018-08-12 08:22:08
Most beautiful city on earth at this time of year,841,22uw0g,http://imgur.com/trLfkg1.jpg,70,1397344788.0,841,0,evoxio,,2014-04-12 19:19:48
"People Chanting ""Metro Sucks"" at the Nats game following announcement that the last train of the night is leaving.",845,57ebpj,https://twitter.com/Maddie_Marshall/status/786761868291502080,151,1476443029.0,845,0,Snakebite7,,2016-10-14 07:03:49
Row houses near Meridian Hill on a Sunday afternoon stroll,839,c9ar2m,https://i.redd.it/aj4j46mwce831.jpg,14,1562323084.0,839,0,sdkb,,2019-07-05 06:38:04
"D.C. Mayor Muriel E. Bowser will announce legislation Thursday to legalize and regulate recreational mari juana dispensaries in the nation’s capital, setting up a potential showdown with the federal government.",842,bjtpvc,https://www.washingtonpost.com/local/dc-politics/dc-mayor-muriel-bowser-unveils-bill-to-legalize-recreational-marijuana-sales/2019/05/01/108ac2fa-6c19-11e9-a66d-a82d3f3d96d5_story.html,102,1556824528.0,842,0,redditor01020,,2019-05-02 15:15:28
"Even in Los Angeles, no one is safe from a Maryland driver (x-posted from /r/LosAngeles)",835,879ka2,https://i.redd.it/zgetetepmyn01.jpg,105,1522103699.0,835,0,Dr_Midnight,,2018-03-26 18:34:59
DCA airport has probably the best landing view of any domestic airport [OC],837,6oa5rw,https://i.redd.it/4xg4lxmw3laz.gif,105,1500515268.0,837,0,jpezzznuts,,2017-07-19 21:47:48
"Technically in Virginia, but it's the DC metro",835,6lende,https://i.redd.it/6sasfidfjs7z.jpg,74,1499296637.0,835,0,MountainMantologist,,2017-07-05 19:17:17
The Tiles at Nat Postal Museum are quite satisfying,830,av7ij9,https://i.imgur.com/7XfWHCP.jpg,25,1551260543.0,830,0,f1sh98,,2019-02-27 04:42:23
Fixed It.,824,asvstn,https://i.redd.it/xfxpxsdeath21.jpg,112,1550735748.0,824,0,Tunde88,,2019-02-21 02:55:48
Columbia Heights Metro- with new LED lighting. It looks pretty cool!,827,a90mj0,https://i.redd.it/i2057k3it4621.jpg,75,1545645171.0,827,0,mriphonedude,,2018-12-24 04:52:51
Amtrak Launches Nonstop Service Between NYC and DC,824,d84a3u,https://www.nbcnewyork.com/news/local/Amtrak-Launches-Nonstop-Service-Between-New-York-City-and-Washington-DC-561106051.html,232,1569260741.0,824,0,JoseTwitterFan,,2019-09-23 13:45:41
This is a full-page ad in today's Washington Post,826,76iup6,https://i.redd.it/huikjhektzrz.jpg,64,1508101754.0,826,0,DC_diff,,2017-10-15 17:09:14
Trumps shitotel in DC tonight ayyyy,821,7q9q3x,https://i.redd.it/hdu1xz1n3y901.png,126,1515932290.0,821,0,ljx787,,2018-01-14 07:18:10
Found this DC statehood poster from 2006 in the Library of Congress photo archive,818,b81b4a,https://i.redd.it/9o1gyr216np21.jpg,75,1554148445.0,818,0,TrueBirch,,2019-04-01 15:54:05
Caught the holiday rush back into the city,818,a11nms,https://i.redd.it/0vi9e7kzbz021.jpg,31,1543399506.0,818,0,Rucca_v,,2018-11-28 05:05:06
Just your usual Thursday in DC,818,9tfwq9,https://i.redd.it/uicx5se2rtv11.jpg,38,1541152722.0,818,0,0gg116,,2018-11-02 05:58:42
My mom is a florist and she made a big flower heart on the National Mall today to show people in D.C. some love,811,aqrk01,https://imgur.com/gallery/Lpk2H72,32,1550224757.0,811,0,ThePeoplesBard,,2019-02-15 04:59:17
"A kid left their stuffed bunny on the metro, likely at got off at the Foggy Bottom stop. Dropping it off at the Pengaton City metro booth, so it'll be there or the lost and found. Just in case you know the kid by a long shot",805,du12nb,https://imgur.com/2K97jzV,36,1573359262.0,805,0,mrcarlita,,2019-11-09 23:14:22
Beneath Connecticut Ave. this past weekend,804,e1ixux,https://i.redd.it/85geu7xf6v041.jpg,19,1574730289.0,804,0,blakespot,,2019-11-25 20:04:49
Morning sprints (OC),806,d0xwg4,https://i.redd.it/uuceyu4v47l31.jpg,16,1567901458.0,806,0,sooocahl,,2019-09-07 20:10:58
"Some Metro escalator railings are now colorful, signalling which train line they take you to",804,8ay7sz,https://twitter.com/thejennyjude/status/982969506598408192,105,1523307561.0,804,0,casiopt10,,2018-04-09 16:59:21
Oh DC...,806,cujxsk,https://i.redd.it/u9ev9knwj9i31.jpg,90,1566623185.0,806,0,insertnamehere913,,2019-08-24 01:06:25
"Tiberius the Carpathian, scourge of the shutdown",802,aa9nhp,https://i.imgur.com/bcg28fE.jpg,35,1546026384.0,802,0,SAVAGEtiki,,2018-12-28 14:46:24
One of the best things about living in D.C. is seeing this in my mirror on the way home.,802,9h6xir,https://i.redd.it/5390i9aq78n11.jpg,45,1537405226.0,802,0,howlermouse,,2018-09-19 21:00:26
"Finally, fall has arrived in the District!",802,7b1z4z,https://i.redd.it/x9ouu4fne9wz.jpg,12,1509961188.0,802,0,AnonymousHillStaffer,,2017-11-06 04:39:48
Friend just messaged me on his way home from work,805,86o2sz,https://imgur.com/bSz4VD0,44,1521867448.0,805,0,dkviper11,,2018-03-24 00:57:28
Day 31 of the shutdown,800,aipd41,https://i.redd.it/tjsal1g9nzb21.jpg,32,1548208165.0,800,0,goopy-goo,,2019-01-22 20:49:25
I hope you all can stand one more picture from last night. Sunset over the anacostia.,796,9uywq8,https://i.redd.it/jqn00vilhww11.jpg,13,1541621690.0,796,0,roflthrowaway9,,2018-11-07 15:14:50
"6 years ago today, we remember. we rebuild.",804,6vii8p,https://i.redd.it/366ivdkn9hhz.jpg,106,1503518718.0,804,0,dj_harbor_seal,,2017-08-23 16:05:18
Was able to capture a beautiful sunset over the weekend.,798,dxtkda,https://i.redd.it/8fijpk4ombz31.jpg,13,1574057745.0,798,0,whodoesntlovedogs,,2019-11-18 01:15:45
I’ve lived here for 4 years and had never seen the Meridian Hill Park fountain running until last month.,798,cijoqk,https://i.redd.it/0gj6k2jqjvc31.jpg,50,1564274412.0,798,0,phisco125,,2019-07-27 20:40:12
This mobile billboard is driving through the D.C. streets today exposing “Net Neutrality Traitors” who have failed to support the Congressional Review Act,792,a66vj2,https://i.redd.it/f34ziiud3a421.jpg,81,1544837351.0,792,0,fightforthefuture,,2018-12-14 20:29:11
"Ahh, Christmas in the City is Finally Here!",789,a172gi,https://i.redd.it/twnvtk2193121.jpg,18,1543446940.0,789,0,hellafyno,,2018-11-28 18:15:40
I could watch planes and boats pass by for hours (Southwest),788,bojxmz,https://i.redd.it/od4b9z6dx6y21.jpg,37,1557874432.0,788,0,souporthallid,,2019-05-14 18:53:52
Peak Bloom,783,b8le62,https://i.redd.it/uhun8h53nvp21.jpg,3,1554251034.0,783,0,szuhay,,2019-04-02 20:23:54
Shutdown rally outside AFL-CIO,784,aelqj6,https://i.redd.it/epmzskpi0n921.jpg,87,1547172999.0,784,0,teetime11,,2019-01-10 21:16:39
"One of my favorite places to shoot at night in the city, the Chinatown Archway.",787,8i1aw3,https://i.redd.it/2pe79h6xtpw01.jpg,49,1525850547.0,787,0,whodoesntlovedogs,,2018-05-09 03:22:27
Here's to Stan. We'll miss you.,787,a5c2cf,https://www.reddit.com/r/washingtondc/comments/a5c2cf/heres_to_stan_well_miss_you/,34,1544597913.0,787,0,mottman,"Yesterday we lost a member of our community. Every day Stanley Eubanks sat on the corner of E St SW and 3rd St SW right across from NASA HQ. He was a friendly man, always saying hello to passersby. He knew our names and listened to us talk about our lives. In return we learned about his. The local dogs loved him so much their owners would get frustrated by their insistence on greeting him.

Stan spent last winter making sure he could find the hypothermia van so he wouldn't freeze on the streets. This past year he finally found housing and was excited to not have spend the night outside in the cold. He also found a part time job and was so proud to be bringing in money of his own. Then he had knee surgery to help with chronic joint pain. He slipped in his kitchen post surgery and shattered his leg. Over the course of the next six months doctors passed him around telling him he'd need surgery or amputation or nerve blocks. He lost his job and was in danger of losing his housing. All the while his heart was failing because of the damaged, unhealed leg. Last week he told me the doctors told him he was out of options. He had grown so weak surgery would kill him. I hadn't seen him the last few work days and feared the worst. Today I learned he had passed. 

Stan had a storied history and was far from a perfect man. He grew up in poverty and abuse. He spent time in prison and was estranged from most of his family. He was a man working hard to escape poverty and gain stability. For all his faults and hardhip he was always cheerful and kind to us. I for one will miss him.",2018-12-12 01:58:33
Projection on EPA headquarters right now,781,87wshr,https://imgur.com/7XPJHlI,24,1522310157.0,781,0,PowerCarrot,,2018-03-29 03:55:57
The Addams Family House at Logan Circle,781,cmozea,https://i.redd.it/u2kl3fid5te31.jpg,42,1565117044.0,781,0,_nameer,,2019-08-06 14:44:04
New move when you get caught by the door of the 7000 series during rush hour,775,5okhb9,http://i.imgur.com/euZECwg.gifv,31,1484713471.0,775,0,I_Fen_Save_Fjords,,2017-01-17 23:24:31
Got a love hate relationship with this city. Rn its all love 💕,775,d1rx1l,https://i.redd.it/vnc071df0ll31.jpg,21,1568069462.0,775,0,sulli3m,,2019-09-09 18:51:02
Really cool All Star insert image from the Post,773,8yk4ze,https://i.redd.it/0ofe74460q911.jpg,20,1531518675.0,773,0,MrTacoMan,,2018-07-13 17:51:15
Saw these kids in Old Town Alexandria Market Square. Was super impressed and wanted to share a sample to spread their name! Info is on the poster they hung.,766,bsz336,https://v.redd.it/h13fxh321f031,75,1558844342.0,766,0,lairbear12,,2019-05-26 00:19:02
LMFAO,774,41xgqe,http://i.imgur.com/3oeAkxB.png,295,1453367426.0,774,0,Cyrix2k,,2016-01-21 04:10:26
DC Cherry Blossoms,767,1c4qus,http://imgur.com/G2tTPpR,58,1365713952.0,767,0,Mommybear,,2013-04-11 16:59:12
"I may not be Latvian, but this banner on their embassy speaks to me on a deep level",770,ce2ksj,https://i.redd.it/jh2bnm2u6qa31.jpg,38,1563337822.0,770,0,TrueBirch,,2019-07-17 00:30:22
Washington DC sports team advances to a conference championship for the first time in decades as Capitols defeat the Penguins to go to the conference final,769,8ht38m,https://www.reddit.com/r/washingtondc/comments/8ht38m/washington_dc_sports_team_advances_to_a/,96,1525773782.0,769,0,MrTacoMan,,2018-05-08 06:03:02
"Tian Tian, the panda, is having a pretty great time in the snow.",765,42bav8,https://twitter.com/NationalZoo/status/690915532539838464,25,1453592680.0,765,0,zzj,,2016-01-23 18:44:40
I recreated Rosslyn Station in Minecraft.,761,cdht27,https://imgur.com/a/Jvv7wHj,61,1563227999.0,761,0,bluesheep123,,2019-07-15 17:59:59
Pretty light on an evening run. Swann St. NW.,767,crs6sm,https://i.redd.it/uuckfjitt2h31.jpg,33,1566105925.0,767,0,MaggsToRiches,,2019-08-18 01:25:25
Tonight in front of the White House,761,9vf9lv,https://i.redd.it/r3fm214d07x11.jpg,67,1541749279.0,761,0,dieyoufool3,,2018-11-09 02:41:19
"My brother was jumped on a metro train last night, if anyone knows these individuals please contact Metro PD.",769,65yox4,https://i.redd.it/e9dephggr6sy.jpg,199,1492495235.0,769,0,WhatAboutGarbage,,2017-04-18 02:00:35
1969 in 2019. Happy Apollo Week DC!,765,ceffow,https://i.redd.it/aqe0pnq98wa31.jpg,26,1563410946.0,765,0,Rucca_v,,2019-07-17 20:49:06
I guess that’s one way to encourage metro use?,762,bykid8,https://i.redd.it/vrys4dq18c331.jpg,73,1560117797.0,762,0,cafecoffee,,2019-06-09 18:03:17
We’re leaving our apartment in a few months and I’m going to miss the view.,757,azm6ac,https://i.redd.it/tjp8iwk1pdl21.jpg,33,1552290369.0,757,0,konfetkak,,2019-03-11 03:46:09
Wholesome closing,757,ag94qx,https://i.redd.it/7ah4r2a7aia21.jpg,10,1547591981.0,757,0,petitcastor92,,2019-01-15 17:39:41
Ouch,763,aej88x,https://i.redd.it/hwuo8ltxml921.jpg,49,1547156453.0,763,0,TrueBirch,,2019-01-10 16:40:53
You know you're in the rough part of Georgetown when you see boat shoes hanging from the power lines,762,6ioesy,https://i.redd.it/todw3mtf225z.jpg,41,1498104418.0,762,0,jewsanon,,2017-06-22 00:06:58
No one believes me when I describe the Burger King near UDC,754,9onuc2,https://i.redd.it/04zoh64mzjs11.jpg,97,1539727005.0,754,0,mucow,,2018-10-16 17:56:45
Fantastic Sunrise at the Capitol this Morning [OC],758,7gme2a,https://imgur.com/PcJPqhV,27,1512078061.0,758,0,someguy9,,2017-11-30 16:41:01
Washington National Cathedral,752,apohjy,https://i.redd.it/7wcenbfrx1g21.jpg,28,1549968763.0,752,0,mdw1705,,2019-02-12 05:52:43
To the guy that air drops his dog to people on the red line....I GOT IT TODAY!!! Here is what I tried to send back. 🙂,756,ck8juh,https://i.redd.it/4mi4demw5nd31.jpg,60,1564608732.0,756,0,carlyqfries,,2019-07-31 17:32:12
This gem added some joy to my gloomy day... hope it adds some to yours too!,746,acvq7e,https://i.redd.it/8qib35d4wm821.jpg,32,1546735673.0,746,0,bdailyherald,,2019-01-05 19:47:53
Rat Trump in Dupont Circle,742,6wt81i,http://i.imgur.com/N1XSRpJ.jpg,39,1504060405.0,742,0,Pupikal,,2017-08-29 22:33:25
Insane reflections on the Potomac,743,7hdy2x,https://i.redd.it/p5t9vl5g4t101.jpg,32,1512379189.0,743,0,nickeldubz,,2017-12-04 04:19:49
The Holiday Season has started at Union Station,742,dztlpp,https://i.redd.it/jiza1tl245041.jpg,40,1574414765.0,742,0,someguy9,,2019-11-22 04:26:05
I heard you like fog photos,737,5m3uau,https://i.redd.it/lbwi6itm7t7y.jpg,18,1483614224.0,737,0,AnonymousHillStaffer,,2017-01-05 06:03:44
Autistic best friend needs help finding plushies lost at Rosalyn metro station,741,cgmi4v,https://www.reddit.com/r/washingtondc/comments/cgmi4v/autistic_best_friend_needs_help_finding_plushies/,53,1563876507.0,741,0,ColonialTransitFan95,"But my best friend (he has have autism) lost two of his plushies that mean a lot to him today at Rosslyn station if you have spotted them please get in contact with me so we can get them home! The first one is a small piplup plush (Pokemon) and the other is a blue dolphin both are from Japan. If you see them, please contact me.

&#x200B;

https://preview.redd.it/z2xvq5hjoyb31.jpg?width=4032&format=pjpg&auto=webp&s=c6de89cfeba05a6da1c017449e01b97bbbce3f58

https://preview.redd.it/4vtvj5hjoyb31.jpg?width=4032&format=pjpg&auto=webp&s=a3a11f270b70a269021cf8ece583f714a525fbbe

https://preview.redd.it/cvcpn6hjoyb31.jpg?width=4032&format=pjpg&auto=webp&s=a7cab4e0529171789ba6327955ccab5c6986b512",2019-07-23 06:08:27
"I know, another leaf photo, but Rock Creek Park was magical today!",742,9toytb,https://i.redd.it/ur4ftnosxzv11.jpg,20,1541227635.0,742,0,howlermouse,,2018-11-03 02:47:15
Here’s what greeted Southwest flights from Tampa today.,742,8lvavy,https://i.imgur.com/guiSTxS.jpg,20,1527218040.0,742,0,Slikoniko,,2018-05-24 23:14:00
The Apollo view from the Capitol,737,cf6weh,https://i.redd.it/bsz7ly2339b31.jpg,43,1563567872.0,737,0,Roleman44,,2019-07-19 16:24:32
How Google Maps shows the Pride Parade,739,bxynuk,https://i.redd.it/e250scfziz231.jpg,51,1559964101.0,739,0,lewalani,,2019-06-07 23:21:41
Love the morning commute,738,aeaadh,https://i.redd.it/rryduxij7g921.jpg,50,1547090613.0,738,0,BateGuy,,2019-01-09 22:23:33
"Stand on the right, Step on the left",739,8evr4i,https://i.redd.it/3td86qnzi3u01.jpg,47,1524708825.0,739,0,hulkvsspawn,,2018-04-25 22:13:45
Government Shutdown,736,7rmjy1,https://i.redd.it/jddjcbgc14b01.jpg,47,1516433919.0,736,0,HBScott1961,,2018-01-20 02:38:39
Unbelievable DC Sunrise Today,729,dj4xf6,https://i.redd.it/zhzp0na053t31.jpg,24,1571339862.0,729,0,Bobinho4,,2019-10-17 15:17:42
Postcards from Washington DC [#108] : Fireworks from a Basement Party,735,8vmjxy,https://i.redd.it/mr3i7t29ul711.jpg,42,1530596567.0,735,0,carmonamedina,,2018-07-03 01:42:47
The National Cathedral was looking pretty great this morning.,737,e0slxo,https://i.redd.it/27szww91tj041.jpg,20,1574592599.0,737,0,Dfizzle2,,2019-11-24 05:49:59
Johnny Cash to replace Confederate statue on Capitol Hill,731,bekmcc,https://www.washingtonpost.com/politics/johnny-cash-to-replace-confederate-statue-on-capitol-hill/2019/04/17/27058054-6153-11e9-9412-daf3d2e67c6d_story.html,106,1555617154.0,731,0,bluesycheese,,2019-04-18 15:52:34
This is pretty much the opposite of the cherry blossom pics that crop up here in April,735,7pzwj8,https://i.redd.it/bf21tukqgp901.jpg,13,1515821643.0,735,0,WAMU_885,,2018-01-13 00:34:03
"Welcome to DC, new folks. Now here's the 411.",726,3apnpk,https://www.reddit.com/r/washingtondc/comments/3apnpk/welcome_to_dc_new_folks_now_heres_the_411/,318,1435011105.0,726,0,,"/r/washingtondc has been getting a ton of posts lately for people moving to dc and having really unrealistic expectations in finding a place to live. So, to hopefully stem the tide, here's some pointers before posting your situation:

1. Accept that DC is an expensive place to live.  Like Captain Spiers said, once you accept you're already dead, you can function like a soldier. Same thing goes with renting in DC. I don't care where you're coming from. If it's not SF or NY (in this country), chances are you are going to experience sticker shock. Get over it. DC metro area is generally the third most expensive market to live in outside of SF/NY. The market does not care what your projected budget is so you will either have to increase your budget or get used to alternative living arrangements that you may not be used to.

2. Use the sidebar. The tourist guide, the tenant survival guide, /r/DCforRent are all useful. Also use the search function. You are not the first person to be moving to DC.

3. DC has become a dynamic and lively place to live. You're no longer restricted to parts of Capitol Hill and NW to live in. The population of DC has grown 100k in the last ten years. You new folks are part of that explosion growth. And because of such, everyone is willing to live everywhere now. Including east of the Anacostia river.

4. Your best possible situation is if you are moving here with a roommate or SO already and you're both working.

5. If you are moving here by yourself with no resources, start looking at either sublets, roommates needed situations or biggest of all, the group house. Especially if you have a budget less than $1000/month.

6. Understand and factor in commuting time and costs into your decision where to live. It's a trade off: you pay more to live in DC because you have easy access to all that it offers. Most people don't even need a car in the District and if you do need one, there is Car2Go, Lyft, Uber, Zipcar, blah blah blah.

7. Also understand our Metro system is OK but it can suck big time. Especially on the weekends. So if you are on the fence about living in MD but will have ""easy access"" into DC via the Red line, think again.

8. If you're moving here with a car, do yourself a favor and register it in DC. Parking Enforcement is probably the most efficient department in all of DC government and your out of state plate will not save you from tickets, ESPECIALLY if you are parking on the streets. Also take careful note where you're parking and read the signs. Don't cry to us when you get that $100 courtesy tow ticket. Deal with it and also take that into consideration when looking for place to live. If you want to move to Adams Morgan or Dupont with a car but don't want to pay the $250/mo parking spot? Good luck. If you're living in Brookland, not really a problem.

9. There is crime here. It's a city so it's inherent. But it is nowhere near as bad as it was during the 80s/90s or even early aughts. When you read on neighborhood blogs about people complaining about pop-ups or someone painting their back deck bright colors, I think DC is gonna be alright.

10. Lastly, stand on the goddamn right, walk on the fucking left.

Welcome to the District!",2015-06-22 18:11:45
Last nights sunset at the DC United match,726,ctvr77,https://i.redd.it/oqk2nmi1ezh31.jpg,28,1566500145.0,726,0,Schulzayyy,,2019-08-22 14:55:45
