title,score,id,url,comms_num,created,ups,downs,author,body,timestamp
Here’s a funny story about people not believing DC is a place,651,awpkkp,https://www.reddit.com/r/washingtondc/comments/awpkkp/heres_a_funny_story_about_people_not_believing_dc/,170,1551609460.0,651,0,winterswrath7,"Went up to VT, as I sometimes do, to do a spot of skiing. After the drive up, my dad and I go get dinner at a bar in Stowe. While he’s parking, I go inside and order beers for us. I present the bartender with my DC driver’s license, and she looks at it skeptically. 

This sometimes happens in Vermont because they mostly see people from New England. I have the new DC ID, which includes the holographic thingamajig in the corner. I assure her that that’s the most legit ID out there, it’s probably very difficult to create a fake one. 

Bartender: Do you have a passport or something?

Me: Why?

Bartender: I can’t accept an ID from another country.

Me: Another country?

Bartender: Yeah, the District of Colombia. Isn’t that in the Caribbean or something.

Me: (Getting mad) That’s the capital. Of the United. States. Of. America.

Bartender: (getting mad cause she realizes she just made up a country) Well, you don’t have to get mad. I’m just doing my job. 

Then she asked who the other beer was for and I said my father, who is also from the great country of DC. 

Important to note that I love Vermont to death, but DC actually has more people than the whole state of VT. 

Edit: I’d be less pissed about it if we had the representation, but we don’t have the representation, so can I at least have the beer?",2019-03-03 05:37:40
Saturn V Rocket projected on the Washington Monument tonight,646,ce6t44,https://i.redd.it/8j2cgaqqyra31.jpg,30,1563359315.0,646,0,delgadophotos,,2019-07-17 06:28:35
This guy.,652,8lpko5,https://i.imgur.com/85Otw4f.jpg,35,1527161189.0,652,0,dcpanthersfan,,2018-05-24 07:26:29
Photo from this morning’s sunrise at the Capitol [OC],648,85j07e,https://i.imgur.com/ypL2Vnu.jpg,30,1521490557.0,648,0,someguy9,,2018-03-19 16:15:57
Snow was no impediment to this visitor at Arlington National Cemetery today,645,9xefrf,https://i.redd.it/5e56n27zqjy11.jpg,33,1542339262.0,645,0,WAMU_885,,2018-11-15 22:34:22
Lunchtime in Logan Circle,646,b8dk4t,https://i.redd.it/qz1140elnrp21.jpg,19,1554202777.0,646,0,seanshootsshots,,2019-04-02 06:59:37
Washington Capitals fan donates $19K jackpot raffle winnings to synagogue shooting victims,647,9vky95,http://www.fox5dc.com/sports/washington-capitals-fan-donates-19k-jackpot-raffle-winnings-to-synagogue-shooting-victims,17,1541803214.0,647,0,fox5dcnews,,2018-11-09 17:40:14
A non-exhaustive guide to the helicopters of DC,647,8u3erg,https://www.reddit.com/r/washingtondc/comments/8u3erg/a_nonexhaustive_guide_to_the_helicopters_of_dc/,139,1530073750.0,647,0,celocanth13,"So maybe you're a tourist/new-comer and you're wondering ""wow, there is so much helicopter traffic here! This is so neat, I wonder what all these helicopters are?"" or maybe you've been here a while and are thinking ""shut up you stupid helicopters! Fwop fwop fwop, I get it, you can hover, big deal!"" but are still curious as to what these helicopters are. Well, I've put together a handy-dandy guide of helicopters and VTOL aircraft that I've seen zipping around.

**Presidential Helicopters and VTOL**

Now, Marine One is any helicopter that the POTUS is in but there is one iconic helicopter associated with the name, the [Sikorsky VH-3D Sea King](https://i.imgur.com/Sqfdt1P.jpg). This big guy is commonly seen circling the city usually accompanied by one or two [VH-60N White Hawks](https://i.imgur.com/YGmsKwd.jpg). Occasionally you may see these making a landing at the White House or Naval Observatory.

The VH-3D is going to be replaced by 2020 by the [VH-92A](https://www.cnbc.com/2018/04/10/marine-one-upgrade-next-presidential-helicopter-fleet-getting-closer-to-debut.html)

Much more rare is the [MV-22B](https://i.imgur.com/llv1Ylp.jpg), a VTOL aircraft operated by HMX-1

**Military**

The military also has specially marked helicopters for VIP transport. The US Army's 12th aviation battalion has a presence here with several helicopters. Most recognizably is the [VH-60N ""Gold Top""](https://puu.sh/AMpCz/b8c9d71e46.jpg). the Army also maintains conventional [UH-60 Black Hawks](https://i.imgur.com/wDeLmuv.png) (often seen with the external fuel tanks as pictured) and the much smaller [UH-72A Lakota](https://i.imgur.com/YzMGUiG.jpg).

Not to be outdone, the Air Force also has a presence here with the USAF 1st helicopter squadron. This squadron is made up of specially painted [UH-1N Hueys](https://puu.sh/AMpOl/28482a9b39.jpg). These can typically be seen flying back and forth along the Potomac River.

Last but certainly not least is the [United States Coast Guard Eurocopter HH-65D Dolphin](https://i.imgur.com/BCRszHh.jpg). This strikingly orange helicopter can be seen traversing up and down the rivers. 

**Police and EMS**

The US Park Police have two [Bell 412 helicopters](https://i.imgur.com/0V3kw0n.jpg) that they use for law enforcement, search and rescue and medevac in the DC area. These can typically be seen near the river and National Parklands.

The Metropolitan Police Department also has two helicopters, Eurocopter AS350B3, pictured [here](https://i.imgur.com/V2HTkBw.jpg) and [here](https://i.imgur.com/20j0btS.jpg). Non-residents may recognize this helicopter from the movie Spiderman: Homecoming. They do police stuff and are mostly nocturnal.

Maryland State Police operates a rather large [Agusta Westland AW-139](https://i.imgur.com/gdfwt27.jpg) that can sometimes be seen in the region.

MedStar has it's own helicopter used for patient transfers and medevac flights, this life saver is distinguishable by its [bright yellow color](https://puu.sh/AMqnR/58f1ba7c57.jpg). This is an Eurocopter EC-135.

Much rarer is [INOVA Fairfax's helicopter](https://i.imgur.com/8gnmyuZ.jpg) which is operated by PHI Air Medical.

**Other**

NBC4 operates a [Bell helicopter](https://puu.sh/AMsO3/57b19a4330.jpg)

~~I've seen some sleek retractable landing gear black helicopter, looks like its for charter/private flights, if you know more about it let me know so I can add it to the post.~~ Belongs to DHS, will update with more info later.

I know there's more! If I missed something or if you have corrections or info to add let me know!",2018-06-27 00:29:10
The morning light shines over the Washington Monument to create a picturesque array of colors.,640,8tqeq3,https://i.redd.it/v6gm6a31d5611.jpg,17,1529961231.0,640,0,meigs68,,2018-06-25 17:13:51
Rear Metro View from Arlington Cemetery to Rosslyn,641,bvt1f9,https://v.redd.it/uslpecfqwu131,38,1559473482.0,641,0,Massply,,2019-06-02 07:04:42
The view from the bottom of Lock 3 of the C&O Canal in Georgetown,640,9ndlud,https://i.redd.it/0chl1u4w8mr11.jpg,47,1539318469.0,640,0,WAMU_885,,2018-10-12 00:27:49
Taking full advantage of this meme ban suspension: DC sports teams,635,dpicd6,https://i.imgur.com/5CqRjbz.jpg,16,1572523715.0,635,0,dcpanthersfan,,2019-10-31 08:08:35
National Christmas Tree is not lit because of government shutdown. So much for Christmas spirit.,639,a8pph5,https://i.imgur.com/iHLzww4.jpg,44,1545550477.0,639,0,CharlotteHebdo,,2018-12-23 02:34:37
Lincoln Memorial before the reflecting pool,641,by4o82,https://i.imgur.com/twrDBRw.jpg,41,1560000805.0,641,0,chivopi,,2019-06-08 09:33:25
Abraham Lincoln's favorite view,640,91m1tm,https://c1.staticflickr.com/1/934/28731509037_3b76030f16_h.jpg,26,1532499910.0,640,0,mrgambitjr,,2018-07-25 02:25:10
WONDER WOMAN 1984 filming in and around the Watergate today,641,8rbpre,https://i.redd.it/8dbdjn2cl6411.jpg,64,1529104525.0,641,0,napstimpy,,2018-06-15 19:15:25
Virginia Congresswoman-Elect Jennifer Wexton Throws Support Behind D.C. Statehood,634,9vyqpl,https://dcist.com/story/18/11/09/virginia-congresswoman-elect-jennifer-wexton-throws-support-behind-d-c-statehood/,126,1541919430.0,634,0,PrestoVivace,,2018-11-11 01:57:10
"I made a spreadsheet with all DC museums, including links to their website and what I could find on pricing. Enjoy!",643,5n5usd,https://docs.google.com/spreadsheets/d/1iM1sSXYF7fauaQavb76WWiBxkEoBWIdcx1oyLEQ_0Xw/,113,1484093353.0,643,0,bodaciousbecca,,2017-01-10 19:09:13
Guess you could say I lose my cards easily..,639,9i24mo,https://i.redd.it/iovlerpv7un11.jpg,35,1537671566.0,639,0,BrittneyFett,,2018-09-22 22:59:26
Today was a beautiful day to bike to the city,635,c76cqk,https://i.redd.it/6wwb76gmud731.jpg,27,1561880892.0,635,0,ginapsallidas,,2019-06-30 03:48:12
We need D.C. redditors to hand deliver our FCC comments today — the FCC servers have melted down.,635,2aro5f,https://www.reddit.com/r/washingtondc/comments/2aro5f/we_need_dc_redditors_to_hand_deliver_our_fcc/,113,1405466290.0,635,0,pinwale,"**You guys did it! Our FCC comment was filed because of what you did. Thank you, Thank you, Thank you!**

Here is [the photo of reddit's comment with the FCC stamp on it](http://www.reddit.com/r/pics/comments/2aspjb/today_with_just_a_few_hours_notice_over_a_dozen/).

More [photos of the impromptu reddit meetup](http://www.reddit.com/r/washingtondc/comments/2astxe/managed_to_grab_a_few_photos_of_all_the_redditors/) in front of the FCC building!

----------

We need you to help us hand-deliver our official FCC comment so it can be considered in the initial comment period. Here is [the blogpost about it](http://www.redditblog.com/2014/07/join-us-reddit-is-filling-fcc-comment.html).

We don't have any reddit employees close enough to deliver them, so we need your help again.

This is what you need to do to successfully hand deliver reddit's comment:

1. Print out 2 copies of [our official FCC comment with the cover letter](https://docs.google.com/document/d/1GT1QZq1QrXfBt4NZQIjqzlO7NA-xwcleODENIVM7ZzQ/edit) right here.
2. Take the documents (without an envelope) to [this address in Washington, D.C.](http://www.fcc.gov/encyclopedia/electronic-and-hard-copy-filing-address)
3. Arrive there at today at 3:15 p.m. ET
4. Be an internet hero!

Just please remember:

* be polite
* no envelopes (seriously)
* please take photos & videos—we'll feature them on the reddit blog
* you will be going through security
* the FCC building is about 3 blocks from the Smithsonian metro station
* the [likely meeting place is right here](https://www.google.com/maps/place/Potomac+Center+Cf+LLC/@38.88394,-77.028099,3a,75y,255.84h,74.2t/data=!3m4!1e1!3m2!1s-4AVAziZvySv76X594tmqw!2e0!4m7!1m4!3m3!1s0x89b7b775dd015009:0x98c13836a73fbbce!2s445+12th+St+SW,+Washington,+DC+20024!3b1!3m1!1s0x0:0x32dbab57001e635c) next to the FCC building.

**very important**: you must have two copies of our FCC comment when delivering it.

It would be wonderful if we could have a group of redditors make the trip so we can also drive the idea that people are using sneakernet to help protect the open internet.  :D

Let me know if you can do this and I'll get in touch with you.  If possible, there will also be a group of advocacy groups also submitting documents to the FCC as well.


Thank you in advance!
//pinwale ",2014-07-15 19:18:10
Rainbow over Rock Creek after the rain (OC),635,dlppc8,https://i.redd.it/s2bmv0m656u31.jpg,16,1571812184.0,635,0,hockeyjoker,,2019-10-23 02:29:44
Capitol in the evening,629,8egssy,https://i.imgur.com/Kyy0Rh4.jpg,10,1524562843.0,629,0,Goodasgold444,,2018-04-24 05:40:43
The Save in flipbook form,636,8nv2x0,https://i.imgur.com/BrGUQYo.gifv,16,1527912861.0,636,0,LoganSquire,,2018-06-02 00:14:21
"In July, Metro set to start closing at 3 a.m. on weekends again",630,a5aqi1,http://wjla.com/news/local/dc-metro-weekend-hours-july-2019,80,1544589545.0,630,0,DeleonANC,,2018-12-11 23:39:05
Jack Ryan's bike route from G-town to CIA,629,9cxqky,https://i.redd.it/uaky0br599k11.png,117,1536110414.0,629,0,junto_x,,2018-09-04 21:20:14
Ovi hits the post and taps in his own rebound for the game winning goal last night (xpost from r/sports),634,8gh3k5,https://i.imgur.com/S7jRyXI.gifv,48,1525293778.0,634,0,KanderBear,,2018-05-02 16:42:58
congrats on day 35 of shutdown!,636,ajqni0,https://i.redd.it/rhl7bl9thlc21.jpg,31,1548462177.0,636,0,imabeautifuluglymess,,2019-01-25 19:22:57
At the Capitol right now,632,8f2lhb,https://imgur.com/l3AZxtC,74,1524777737.0,632,0,PowerCarrot,,2018-04-26 17:22:17
Postcards from Washington DC [#127] : Taft Bridge under the rain,628,a6zr1r,https://i.redd.it/cyg349jq9u421.jpg,32,1545081643.0,628,0,carmonamedina,,2018-12-17 16:20:43
"Trump staffers can't get laid, complain to the press about it",628,827e2v,https://www.washingtonian.com/2018/03/05/why-its-hard-for-conservatives-to-date-in-dc-right-now/,323,1520297952.0,628,0,GuyNoirPI,,2018-03-05 19:59:12
Are we still doing 22 minute delay during rush hour pics?,623,d25zkc,https://i.redd.it/byen8sxy0rl31.jpg,101,1568142297.0,623,0,Heliordant,,2019-09-10 15:04:57
D.C. flag inspired console table,626,bl0u7s,https://i.redd.it/onpz8ouhmfw21.jpg,13,1557108041.0,626,0,mn7bw,,2019-05-05 22:00:41
I found a post card from 1932 in an old house in NC. Thought you guys might find it interesting,629,bn6k8f,https://i.redd.it/5xzyt94vjhx21.jpg,31,1557567305.0,629,0,Xwing_,,2019-05-11 05:35:05
"Baseball behind the tenements in Washington D.C., 1948 [2664 x 1824]",621,ay6nqx,https://i.redd.it/52hfkurgkdk21.jpg,46,1551949929.0,621,0,history777,,2019-03-07 04:12:09
Street Turkey,627,a0koak,https://www.reddit.com/r/washingtondc/comments/a0koak/street_turkey/,92,1543277578.0,627,0,barelyahistorian,"Does anyone know why there is a raw seasoned turkey outside of the archives/navy memorial in the middle of Pennsylvania ave?

It has been there since Wednesday.

&#x200B;

[Day 1. It appears](https://preview.redd.it/0prnnosb9p021.jpg?width=960&format=pjpg&auto=webp&s=6456a6382247165f9d4bb6735cca625749078b78)

[Friday- It was starting to smell ](https://preview.redd.it/ckq9vmsb9p021.jpg?width=960&format=pjpg&auto=webp&s=b3fe444c8bc2e930b8e72113b551a834f0569316)

[Monday- Why haven't the rats taken it! ](https://preview.redd.it/veyxaosb9p021.jpg?width=960&format=pjpg&auto=webp&s=986dda53735f6a24403245aff2d8157fd01dc9af)

UPDATE:

[He's not looking good folks. ](https://preview.redd.it/40u1nywk0q021.jpg?width=960&format=pjpg&auto=webp&s=c7a416fe9c9e84848df9fc07b67c99df1e0b4692)

Update 2, 3:22pm turkey is still there,  and this is happening:

[ This guy is laying with the #streetturkey in the middle of Pennsylvania Ave ](https://preview.redd.it/l10xehyvhq021.jpg?width=1836&format=pjpg&auto=webp&s=9aa578965080db9268f58ed2d80f89347704194e)

&#x200B;

UPDATE, Day 5. I thought the street cleaners would get it, it is still there. Someone added flowers and apparently he has a twitter!  @turkey\_street

&#x200B;

https://preview.redd.it/2wzs78iyqv021.jpg?width=4032&format=pjpg&auto=webp&s=dc500dcd2b79b375d5d918674e358ccb37daf9df

UPDATE Day 5, approximately 10:30. It is gone, but never forgotten. DPW picked it up.

&#x200B;

[His mark remains. ](https://preview.redd.it/41x6i3269w021.jpg?width=2048&format=pjpg&auto=webp&s=46280dde0b0450eb36ce18b5a0204999a91e16c7)

His ride to his final resting place. #ripdcstreetturkey

&#x200B;

https://preview.redd.it/2znxkq5a9w021.jpg?width=640&format=pjpg&auto=webp&s=fe42299f479e403f28c0e0490c842673db3bf246",2018-11-26 19:12:58
The Nationals handed Stephen Strasburg their season. He delivered a legendary performance.,624,dp4z8s,https://www.washingtonpost.com/sports/2019/10/30/nationals-handed-stephen-strasburg-their-season-he-delivered-legendary-performance/,40,1572460875.0,624,0,resnica,,2019-10-30 14:41:15
D.C. Just Passed A Historic Bill Mandating 100 Percent Renewable Power By 2032,619,a7mzqh,https://www.huffingtonpost.com/entry/dc-historic-climate-bill-renewable-power_us_5c195218e4b08db990587aea,83,1545259405.0,619,0,pnewell,,2018-12-19 17:43:25
The C&O Canal Towpath was very fall-like today.,624,9u90s7,https://i.redd.it/8mnds8xwvew11.jpg,15,1541408583.0,624,0,zerothirty,,2018-11-05 04:03:03
Jaws on the Hill! 🦈,626,ckxv5a,https://i.redd.it/0iziyi0g1yd31.jpg,21,1564740444.0,626,0,Rucca_v,,2019-08-02 06:07:24
First time in DC and loving it,623,bf65of,https://i.redd.it/73lwfb3k8bt21.jpg,46,1555747386.0,623,0,Foo3112,,2019-04-20 04:03:06
"For those not attending Inauguration next week, here are the places you want to avoid: (Everywhere)",624,5obz4r,https://i.redd.it/xaoiyn2iw3ay.jpg,161,1484615353.0,624,0,AnonymousHillStaffer,,2017-01-16 20:09:13
Its Here!,621,7jrpcw,https://i.redd.it/08v4r3qn8w301.jpg,228,1513288553.0,621,0,PM_ME_UR_POLDERS,,2017-12-14 16:55:53
Waiting for the metro since 1776,619,6233lj,http://imgur.com/a/dMoxj,20,1490773075.0,619,0,MajorityCoolWhip,,2017-03-29 03:37:55
"I laser cut a map of the city, let me know what you think.",626,4cictc,http://imgur.com/y6EXaEP,122,1459326273.0,626,0,GrittyWhiteGuy,,2016-03-30 04:24:33
Cherry Blossoms at Peak Bloom! [OC from Yesterday],621,4bwmqd,https://www.flickr.com/photos/someguy/25731099770/in/dateposted-public/,45,1458944310.0,621,0,someguy9,,2016-03-25 18:18:30
Lightsaber,618,cs2b1x,https://i.redd.it/3mukak1438h31.jpg,10,1566169583.0,618,0,Nathounski,,2019-08-18 19:06:23
"Found at Columbia Heights Metro Station Friday, Dec 14, 2018. If you recognize these people, I'll gladly return the original. Not all memories are in digital format these days, I keep thinking this may be someone's only memory of a loved one.",621,a6s4e0,https://i.redd.it/7zx9fyp31p421.jpg,60,1545018169.0,621,0,googleitmofugga,,2018-12-16 22:42:49
"TIL: DC has been wired with 100gb/s fiber since 2006, but comcast won't let us use it. [x-post from r/technology]",621,27ah87,http://motherboard.vice.com/read/hundreds-of-cities-are-wired-with-fiberbut-telecom-lobbying-keeps-it-unused,96,1401918689.0,621,0,Hawkonthehill,,2014-06-04 17:51:29
Apollo 11 Projection Thursday night,618,cffv8f,https://i.redd.it/wy1dx147ycb31.jpg,61,1563613513.0,618,0,monkeyuprising,,2019-07-20 05:05:13
Vaccines For Kids? New D.C. Bill Would Allow Minors To Get Shots Without Parental Consent,618,axygw1,https://wamu.org/story/19/03/05/vaccines-for-kids-new-d-c-bill-would-allow-minors-to-get-shots-without-parental-consent/,110,1551905366.0,618,0,DeleonANC,,2019-03-06 15:49:26
Feel good story of the week! Twitter (and Reddit) helped get the word out about Roaming Rooster's chicken sandwiches and business has more than doubled!,619,cz76b3,https://www.washingtonpost.com/lifestyle/2019/09/02/forget-popeyes-viral-tweet-has-customers-lining-up-outside-this-immigrant-owned-chicken-sandwich-restaurant-dc/,39,1567556944.0,619,0,fishandtron,,2019-09-03 20:29:04
The view from the Yellow line this evening,621,2h6rls,http://imgur.com/L3CmlzS,11,1411465798.0,621,0,wjtucker,,2014-09-23 05:49:58
Sunrise at the Capitol this morning [OC],618,83opgk,https://i.imgur.com/gQ0fOK5.jpg,14,1520823221.0,618,0,someguy9,,2018-03-11 22:53:41
I’m not much of a photographer but I’m pretty happy with how this one turned out,617,b985x2,https://i.redd.it/1muh7xl6c6q21.jpg,20,1554380523.0,617,0,strippersinspace,,2019-04-04 08:22:03
I've finally visited all 91 Metro Stations (and got a picture at each),617,c7irym,https://imgur.com/gallery/jDxoLuA,76,1561953367.0,617,0,Cythrosi,,2019-06-30 23:56:07
"A Metro shuttle bus that was supposed to go to the Pentagon ended up meandering through D.C., Maryland and Virginia before it wound up at the Anacostia station, prompting an unusual request from the driver: “‘I’m not sure how to get to the Pentagon. Can someone give me directions?'”",617,buiwkg,https://wtop.com/tracking-metro-24-7/2019/05/this-is-embarrassing-metro-shuttle-driver-asks-riders-for-directions/,118,1559186392.0,617,0,wtopnews,,2019-05-29 23:19:52
"TIL Washington Redskins' owner Dan Snyder once cut down trees along the Potomac River so that he could see it from his house. The trees were located in a national park, and a ranger who raised concern about the issue was raided by US Marshals",613,8j64ou,http://reddit.com/r/todayilearned/comments/8j4ppo/til_washington_redskins_owner_dan_snyder_once_cut/,30,1526267366.0,613,0,Musichead2468,,2018-05-13 23:09:26
Caught the sunset at the Washington Monument tonight.,619,44og23,http://imgur.com/9pUKuNc,25,1454919602.0,619,0,discounttoasteroven,,2016-02-08 03:20:02
Nats won their first World Series game!,616,dltreh,https://www.reddit.com/r/washingtondc/comments/dltreh/nats_won_their_first_world_series_game/,44,1571831681.0,616,0,KatzMwwow,,2019-10-23 07:54:41
DC shows up on r/MadeMeSmile,615,apuhj3,https://v.redd.it/5271uxwf15g21,47,1550014365.0,615,0,Himalayasaurus,,2019-02-12 18:32:45
"Did you know that you can see a free movie in or around DC nearly every day this summer? I reformmated the DC Outdoor Movie List from NBC4 into a searchable, filterable list to help you make the most of your summer!",616,8g8ia2,https://docs.google.com/spreadsheets/d/1R9ZIzspOCV3AL9pGqdueqFf8W10OkglUmwRDR7ALMIg/edit?usp=sharing,44,1525210679.0,616,0,discountthundergod,,2018-05-01 17:37:59
Possession of marijuana is now legal in DC and it is utter chaos!,612,2x8pll,https://www.reddit.com/r/washingtondc/comments/2x8pll/possession_of_marijuana_is_now_legal_in_dc_and_it/,149,1424994580.0,612,0,Throtex,Cars sliding around all over the place. Kids staying home from school. Government delays. Madness!,2015-02-26 18:49:40
"DC honors heroes, not nazis",612,96kk42,https://i.redd.it/d57quswlljf11.jpg,14,1534056223.0,612,0,Findingfoster,,2018-08-12 02:43:43
I was walking my dog in Meridian Park this morning and came across this. The park also had a similar tag just like this one posted up a few days after Trump won the election.,614,5qu4rh,https://i.reddituploads.com/04a4ab5cef2a4f3ab83739de102b7569?fit=max&h=1536&w=1536&s=aad748493b1f0ffc8532650aff067a98,81,1485731008.0,614,0,CalifornianBNKR,,2017-01-29 18:03:28
why i love DC,614,doxnkp,https://i.redd.it/lq8gcmg26kv31.png,47,1572417737.0,614,0,left_align,,2019-10-30 02:42:17
Ben's Chili Bowl Mural,610,6pbyyg,http://imgur.com/vUfiSst,41,1500964547.0,610,0,RNutt,,2017-07-25 02:35:47
A homeless guy kicked me in front of Fort Totten today...,616,3kwt98,https://www.reddit.com/r/washingtondc/comments/3kwt98/a_homeless_guy_kicked_me_in_front_of_fort_totten/,100,1442268329.0,616,0,lukenog,"I was smoking in front of the Metro station (a cig not weed) and this drunk homeless guy walked up to me and was like ""you're gonna give yourself cancer, young one"" I told him I was quitting (which is true) and he got really angry. He started yelling ""you're gonna lose your johnson!!! You're not gonna have a Johnson anymore!! It's gonna feel like this!"" And he fucking kicked me in the nuts and I fell over and a bunch of cops tackled him onto the ground and started helping me up and stuff and then I think they arrested him. I was laughing and crying at the same time after the police took him away just cuz it was so absurd.",2015-09-14 18:05:29
"Single, Unemployed Mother Mei Xiang Leeching Off Government",611,3id31n,http://www.theonion.com/article/single-unemployed-mother-leeching-government-51176,17,1440555427.0,611,0,sirernestshackleton,,2015-08-25 22:17:07
Looks like those hate protest groups are in the District. Anyone know where this was?,607,bgj2iu,https://i.redd.it/x860yvygo1u21.png,271,1556068902.0,607,0,thank_u_stranger,,2019-04-23 21:21:42
DC councilmember (or staff) blocking bike lane midafternoon today,610,b6amcw,https://i.imgur.com/CADWU32.jpg,61,1553753667.0,610,0,Bashbro,,2019-03-28 02:14:27
Washingtonians showing each other some love,610,awvacy,https://i.redd.it/ni2xsmzyvuj21.jpg,20,1551657732.0,610,0,TooRanched4TV,,2019-03-03 19:02:12
Everyone in DC drinks. EVERYONE.,606,d99p7e,https://i.redd.it/ei100vse3to31.jpg,49,1569474864.0,606,0,QuidYossarian,,2019-09-26 01:14:24
MPD taking up a handicap spot while its officers are in line at Starbucks in the background #ProtectAndServe,608,cpfg76,https://i.redd.it/gwh3wakbx1g31.jpg,123,1565659186.0,608,0,OmniaMors,,2019-08-12 21:19:46
Recreating DC on a city simulation game,605,70lt8c,https://i.imgur.com/qXLMeWI.jpg,50,1505655191.0,605,0,,,2017-09-17 09:33:11
Seen on 95N,608,6bw3my,http://imgur.com/5cgOTNp,18,1495142081.0,608,0,boobiesiheart,,2017-05-18 17:14:41
Sleepless nights on H St lead to some beautiful photos,604,8zzvce,https://i.redd.it/9bssqlp04sa11.jpg,52,1531980040.0,604,0,Rucca_v,,2018-07-19 02:00:40
wtf,605,17dl6o,http://i.imgur.com/QRy9oMG.png,65,1359338648.0,605,0,supremechalupa,,2013-01-27 21:04:08
The Big Bus always has a way of finding you. (I'm in Miami),606,aua2v7,https://i.redd.it/bapwxn3ovji21.jpg,31,1551057684.0,606,0,thesolmachine,,2019-02-24 20:21:24
Route 1 to Reagan National when Reagan National Metro Station is closed.,600,9vorut,https://i.redd.it/kiv6ypgkodx11.jpg,150,1541829845.0,600,0,Eat-the-Poor,,2018-11-10 01:04:05
One of my favorite places to look for a sunset in the city 👍🏼,606,8fghmo,https://i.redd.it/ndt8vc72tju01.jpg,13,1524905946.0,606,0,whodoesntlovedogs,,2018-04-28 04:59:06
My cat has Natitude,602,di9b8z,https://i.redd.it/gcwrhcfg1qs31.jpg,15,1571181290.0,602,0,loz_64,,2019-10-15 19:14:50
"Street Scene, 11th Street NW, circa 1920-25. My colorization.",601,ani5dh,https://i.redd.it/7ae2hgug4te21.jpg,32,1549426270.0,601,0,EggsAckley,,2019-02-05 23:11:10
"Children in line for the opening of the Metro,1976",602,9db3th,https://i.imgur.com/uPAlaOI.jpg,53,1536211180.0,602,0,history777,,2018-09-06 01:19:40
It’s a shutdown so memes and shitposts are allowed so look at my cat,606,a9uwhd,https://i.redd.it/w431tg29cq621.jpg,57,1545905722.0,606,0,celocanth13,,2018-12-27 05:15:22
"Founding Farmers to pay $1.49 Million settlement to workers for paying sub-minimum wage, failing to provide sick leave",602,99o8m0,https://twitter.com/GeorgetownKILWP/status/1032358027763097600,123,1535066169.0,602,0,8bitben,,2018-08-23 19:16:09
