title,score,id,url,comms_num,created,ups,downs,author,body,timestamp
Remember all those times people said Americans aren't interested in space exploration? Pretty sure the #apollo50 show drew a bigger crowd than the inauguration.,733,cfv0s9,https://i.redd.it/zqop7fej0lb31.jpg,111,1563711018.0,733,0,TrueBirch,,2019-07-21 08:10:18
"I’m loving all the pics of the pretty sunrise this morning, so I’d thought I’d share mine.",726,adp219,https://i.redd.it/p11a0qftt3921.jpg,27,1546940715.0,726,0,bdbrady,,2019-01-08 04:45:15
Not technically dc but still great,726,dt1ror,https://i.redd.it/3gnfb8es3bx31.jpg,138,1573179698.0,726,0,kellis744,,2019-11-07 21:21:38
Highly relatable content!,727,auzeku,https://i.redd.it/wv2hk05wywi21.jpg,34,1551216157.0,727,0,DolemiteGooch,,2019-02-26 16:22:37
I will gladly accept a fare increase if it means Metro installs these escalators.,730,80db6o,https://i.redd.it/k3yk19agrii01.jpg,115,1519683480.0,730,0,AssDimple,,2018-02-26 17:18:00
One positive aspect of the shutdown is significant decrease in traffic in DC...,726,acnb8s,https://i.redd.it/2pxxr9qlch821.jpg,75,1546668574.0,726,0,bdailyherald,,2019-01-05 01:09:34
Sean Doolittle on declining White House invite: ‘I don’t want to hang out with somebody who talks like that’,722,dqfvm0,https://www.washingtonpost.com/sports/2019/11/01/sean-doolittle-declining-white-house-invite-i-dont-want-hang-out-with-somebody-who-talks-like-that/,81,1572699837.0,722,0,FreemanCantJump,,2019-11-02 09:03:57
Garfield Park,725,con6gg,https://i.redd.it/khknt6fe5of31.jpg,31,1565497647.0,725,0,ricardogomez93,,2019-08-11 00:27:27
Zoe Barnes would be the type of bitch to stand in the middle of the escalator (From House of Cards S2E1 - Not a spoiler),722,1yg7z3,http://i.imgur.com/soRs6sY.jpg,120,1392942190.0,722,0,RndmHero,,2014-02-20 19:23:10
Cousteau and I discussing the shutdown over a coffee.,721,aa0bd1,https://i.redd.it/xvuauuaceu621.jpg,16,1545954855.0,721,0,Culper1776,,2018-12-27 18:54:15
Someone must be new to DC street parking...,721,8irqoh,https://i.redd.it/pczz8ssixax01.jpg,166,1526106018.0,721,0,Titan_Arum,,2018-05-12 02:20:18
Probably my favorite picture I took while in DC this past weekend,723,8bwkie,https://i.redd.it/wx6moj58ulr01.jpg,20,1523622982.0,723,0,Grashopha,,2018-04-13 08:36:22
Chilly morning at the Capitol Building,723,5jx068,http://imgur.com/orNKb8d,23,1482527220.0,723,0,notfamousatall,,2016-12-23 16:07:00
Magnolia trees are in full bloom at the Smithsonian Castle,718,b5i3kv,https://i.redd.it/8thbbncqmco21.jpg,23,1553585014.0,718,0,todd6739,,2019-03-26 03:23:34
DC is home,724,ax8c8c,https://www.reddit.com/r/washingtondc/comments/ax8c8c/dc_is_home/,129,1551742199.0,724,0,gray_host,"Not sure if this breaks the rules but I just felt sharing this. 

I am an international student and been here for a year and a half now. Even though it was raining crazy the day I arrived here, I have fallen in love with this city.

Half an hour back, I was travelling from Baltimore to here after the weekend. As the train stopped at the Union Station, I started move towards the door. There was a lady with a couple of bags sitting near the seat close to the exit doors asked ""What station is this"" and the guy near her, also moving to the towards the exit, replied ""DC"". As soon as I heard it, I felt so elated, it felt home. As I finish my program in 2 months I don't know what the future holds for me but I do know that I will always love this city and it will never cease being a home to me, at least in my heart. ",2019-03-04 18:29:59
"Alexandria, VA right now",712,dh369g,https://i.redd.it/yx8jn44ca7s31.jpg,59,1570954235.0,712,0,urbansasquatchNC,,2019-10-13 04:10:35
"WMATA: ""Fuck y'all.""",713,6uxnh3,https://i.redd.it/0yoor6n10ygz.jpg,71,1503285363.0,713,0,casiopt10,,2017-08-20 23:16:03
Message being projected onto the Trump Hotel in DC right now. /X-post from r/pics,715,6bey51,https://i.imgur.com/39lLRuR.jpg,39,1494931909.0,715,0,,,2017-05-16 06:51:49
Took this photo this morning!,710,9s7bk9,https://i.imgur.com/yoDNAUM.jpg,44,1540793852.0,710,0,findingmeno,,2018-10-29 02:17:32
The Potomac is frozen. And pretty.,710,7ninik,https://imgur.com/06jb372,31,1514880039.0,710,0,wandering_bonobo,,2018-01-02 03:00:39
Blue dots represent households with annual incomes greater than $200k and yellow dots represent incomes less thank $25k.,708,7kmlpg,https://i.redd.it/yndg1z6xrp401.jpg,77,1513646261.0,708,0,woofwoofwoof,,2017-12-18 20:17:41
"7,000 pairs of shoes on the East Lawn — which organizers say is one for every child killed by guns since Sandy Hook",712,844cad,https://i.redd.it/gd0rsdnidjl01.jpg,191,1520978430.0,712,0,WAMU_885,,2018-03-13 18:00:30
I wondered around Adams Morgan last night and was stopped by several friendly people to talk about photography and a few asked to get their portraits as well. I love DC nightlife.,707,cxzhq4,https://i.redd.it/chq6yrboxpj31.jpg,53,1567307654.0,707,0,k1ng1992,,2019-08-31 23:14:14
I’ve made a series of magnets inspired in local monuments,711,cpsos8,https://i.redd.it/4x45tku3q7g31.jpg,46,1565729360.0,711,0,carmonamedina,,2019-08-13 16:49:20
Yesterday was the second busiest day for Metro in its 40 year history.,705,5phwmb,https://twitter.com/MartinDiCaro/status/823202396503502848,86,1485131901.0,705,0,Cythrosi,,2017-01-22 19:38:21
Washington Monument through the pillars at the Jefferson Memorial yesterday,705,88ipof,https://i.redd.it/1p8p6ak5s3p01.jpg,5,1522532813.0,705,0,cornejtm,,2018-03-31 17:46:53
"The Nationals are ONE WIN away from giving Washington, D.C. their 1st World Series appearance in 86 years.",711,di1u5p,https://twitter.com/Nationals/status/1183942597968060417,92,1571138264.0,711,0,JoseTwitterFan,,2019-10-15 07:17:44
A pretty sunrise this morning.,706,d7ecfj,https://i.redd.it/f6dv618qrzn31.jpg,3,1569119880.0,706,0,ksm86,,2019-09-21 22:38:00
Barack Obama dons a Santa hat and hands out gifts in surprise visit to D.C. children’s hospital,704,a7sg35,https://www.washingtonpost.com/arts-entertainment/2018/12/19/barack-obama-dons-santa-hat-hands-out-gifts-surprise-visit-dc-childrens-hospital/,38,1545294848.0,704,0,vegdc,,2018-12-20 03:34:08
Hey y’all my uncle went missing as he was heading towards DC. Please help if you can.,708,bfoydc,https://i.redd.it/emy4hfccgmt21.jpg,20,1555883174.0,708,0,Gdotscott,,2019-04-21 17:46:14
Had the privilege of being my friends photographer for his proposal. Shot at Glenstone museum.,703,apflt4,https://i.imgur.com/DnSHzHE.jpg,27,1549915527.0,703,0,findingmeno,,2019-02-11 15:05:27
Amazing sunset last night! Wish the reflecting pool wasn’t drained...,698,9ge2ji,https://i.redd.it/r75j9xmpynm11.jpg,11,1537159993.0,698,0,MojaveMac,,2018-09-17 00:53:13
Long shot -- to the guy who stood up to Metro bully-bum,701,967pci,https://www.reddit.com/r/washingtondc/comments/967pci/long_shot_to_the_guy_who_stood_up_to_metro/,134,1533942256.0,701,0,benditlikebecca92,"Hi. Doubt you'll see this but thought I'd write anyway. I was on a Red Line train with you earlier this week during the evening commute. I was a couple seats away and you were standing. I saw the bummy-looking guy slouched over taking up the whole seat, saw him wake up and smack you in the upper arm and start yelling at you for ""standing too close"".

I don't know how many times I've seen people acting badly on metro, or intimidating others with their bodies, taking up space, yelling, listening to music too loud, etc. It's always upsetting and annoying.

I was so glad you faced up to the guy, and was surprised too. You seemed like a very typical metro commuter -- business casual, older, glasses, minding your own business and looking at your phone.  So when you turned around, got in the guy's face, took off your glasses and asked him if he wanted to start something, I was rooting you on. I don't like violence -- but I hate bullies, especially on metro, where there's nowhere to go to get away and people seem to meekly accept this kind of behavior.

You cowed the guy back into his seat. Then called the conductor. Then had him taken off the train and you talked to the cops. Good for you. I know people around me were annoyed to be delayed and I heard one woman tell you you should drop it and leave well enough alone. But I was so much happier when the guy was off the train -- he was threatening and weird and obviously had no problem assaulting a complete stranger.

So good for you, Metro stranger. I was happy to see someone stand up for themselves!",2018-08-10 19:04:16
United States Botanic Garden,703,c2piq9,https://imgur.com/MiQZP2k,29,1561022075.0,703,0,stupidsexycarver,,2019-06-20 05:14:35
Fellow Furloughed Feds and Contractors: Please Be Kind to the Service Industry!,704,ajgvam,https://www.reddit.com/r/washingtondc/comments/ajgvam/fellow_furloughed_feds_and_contractors_please_be/,107,1548391604.0,704,0,GonzalaGuerrera,"The service industry has been hit so hard in the DC metro area and today I witnessed some extraordinary entitlement that doesn't help anyone. No business owes you a free sandwich and if you get one, try to leave a few bucks or, at the very least, if you are financially unable to, BE POLITE to the service staff. A lot of places offering shutdown deals right now won't let you take the food to go because they expect you to order at least a drink or an appetizer. And to leave a tip! And screaming at the staff and making a huge scene to ""just put it in a box because I am furloughed"" is not the way to go about anything in life. I know some people are doing everything in their power to make ends meet right now but let's be kind and considerate to our service industry friends who are likewise suffering tremendously during this shutdown. ",2019-01-24 23:46:44
Merry Christmas all. Here is a small collection of various Trees around the area.,698,a9fh0y,https://i.redd.it/2o1s851wvf621.jpg,20,1545779149.0,698,0,todd6739,,2018-12-25 18:05:49
Serious shit about to go down on the Mall,699,5mthnn,http://imgur.com/Cba1Dtn,68,1483941349.0,699,0,cleversobriquet,,2017-01-09 00:55:49
"Worst of McMansions - McLean, Virginia",703,4z2kg8,http://www.mcmansionhell.com/post/149128564511/mclean-virginia,141,1471926085.0,703,0,phisco125,,2016-08-23 00:21:25
Union station Christmas tree!,702,a89iwf,https://i.redd.it/h2fdu00fkm521.jpg,16,1545424207.0,702,0,cafecoffee,,2018-12-21 15:30:07
The scene outside the Kavanaugh hearings today,698,9jgqg7,https://i.redd.it/27mfoj9ejuo11.jpg,174,1538111303.0,698,0,WAMU_885,,2018-09-28 01:08:23
Sauron’s view during fireworks,700,c9szvk,https://i.redd.it/o2g8ulo9eo831.jpg,15,1562444412.0,700,0,Bhcoin,,2019-07-06 16:20:12
The DC Department of Healht,698,c4x4si,https://i.redd.it/nvzi4b1trd631.jpg,43,1561444092.0,698,0,thebarkingdog,,2019-06-25 02:28:12
Good Morning DC!,693,8zumgr,https://i.redd.it/0hrhg6p7yoa11.jpg,23,1531941759.0,693,0,dcdenizen,,2018-07-18 15:22:39
Mayor's statement on the Warriors visiting D.C.,697,725syg,https://i.redd.it/u20h5y9wrunz.jpg,69,1506297238.0,697,0,DRF561,,2017-09-24 19:53:58
Beautiful time yesterday evening at the Lincoln Memorial. (Not pictured: the swarm of bugs that hit me immediately after I took this shot),693,crb1oy,https://i.redd.it/xwtb8x7p1vg31.jpg,12,1566011717.0,693,0,mdw1705,,2019-08-16 23:15:17
The DC Climate Strike,691,d6wov0,https://i.redd.it/6m6sbx03rrn31.jpg,89,1569022773.0,691,0,justaladygingerneer,,2019-09-20 19:39:33
Chinatown Metro stop rn,692,8pez2t,https://i.redd.it/zmb1s8d5wn211.jpg,12,1528442178.0,692,0,Juicer18,,2018-06-08 03:16:18
Men’s haircut recommendations in southwest/waterfront? (Don’t up-vote),696,9j244g,https://www.reddit.com/r/washingtondc/comments/9j244g/mens_haircut_recommendations_in/,93,1537994319.0,696,0,souporthallid,Looking for a place to get a moderately priced men’s haircut. Walk-in would be nice. No supercuts and no $100 salons. ,2018-09-26 16:38:39
"I’m sure you guys get tons of these, but thought I’d share this shot from my run yesterday morning anyways.",689,dngug3,https://i.imgur.com/lIKowb4.jpg,19,1572139322.0,689,0,erpa2b,,2019-10-26 21:22:02
"Meta: Can we focus for a second on why the mods approved/pinned an ""AMA"" by a fly-by-night, unaccredited, National Security grad school funded by sketchy ultra-right-wing interest groups?",684,a5ijb0,https://www.reddit.com/r/washingtondc/comments/a5ijb0/meta_can_we_focus_for_a_second_on_why_the_mods/,137,1544653219.0,684,0,Oedipe,"Oh, and then the only questions asked save one were by people who had just created their account or who had been supporting the school in other threads.

Link here: https://www.reddit.com/r/washingtondc/comments/a58a2g/hi_rwashingtondc_were_the_daniel_morgan_graduate/

I think we deserve an explanation from the mod team.

Protip: Do not go to that school if you want to get into national security/foreign policy-based career paths.",2018-12-12 17:20:19
This is a new one.. 31st and M in Georgetown,688,8cwluw,https://i.imgur.com/aNFKlNa.jpg,71,1524001346.0,688,0,leonardoty,,2018-04-17 17:42:26
"LOST CAT-if you live in NW DC by 18 and New Hampshire, please DM me. Any update will help.",684,c06q4z,https://i.imgur.com/UfkVdqK.jpg,40,1560466084.0,684,0,sweatytacos,,2019-06-13 18:48:04
Early Bird Caught a Bird in Thomas Circle,679,azthr7,https://imgur.com/tYO5qJc,50,1552339945.0,679,0,bensun13,,2019-03-11 17:32:25
"Rep. Ocasio-Cortez will pay her staffers no less than $52,000 a year",690,atj1ao,http://www.rollcall.com/news/congress/alexandria-ocasio-cortezs-call-living-wage-starts-office,278,1550878981.0,690,0,Petworth_dude,,2019-02-22 18:43:01
What do you think?,681,aaru1u,https://i.redd.it/fxq6mmh5lb721.jpg,142,1546165948.0,681,0,Rgardner89,,2018-12-30 05:32:28
"Sunrise over DC, as viewed from Rosslyn",689,cyn6xu,https://i.redd.it/5ldpay4hp5k31.jpg,9,1567448328.0,689,0,mahlerific,,2019-09-02 14:18:48
My flight view yesterday. Never get tired of seeing this...,679,bqaymt,https://i.redd.it/oogz0m2ed2z21.jpg,27,1558255132.0,679,0,thestarlighter,,2019-05-19 04:38:52
DCA is beautiful at night,678,7e30if,https://i.imgur.com/4K2fE7O.jpg,106,1511150296.0,678,0,pandamasterful,,2017-11-19 22:58:16
NBC4 News Anchor Jim Vance Dead at 75,681,6ov1r2,http://www.nbcwashington.com/news/local/News4-Anchor-Jim-Vance-Dies-at-75-436001373.html?_osource=SocialFlowFB_DCBrand,76,1500759964.0,681,0,,,2017-07-22 17:46:04
Capitol Hill Fall Color,681,9txuzq,https://i.redd.it/89856dleo6w11.jpg,4,1541309191.0,681,0,coffeenick,,2018-11-04 01:26:31
Union Station approx. 1905-1910,683,7y8gvz,https://i.redd.it/p3guvsd6jtg01.jpg,32,1518921811.0,683,0,AcresWild,,2018-02-17 21:43:31
Shot from the floral library by the Tidal Basin,680,bcqkcr,https://i.redd.it/3lhd3jwsb1s21.jpg,6,1555191561.0,680,0,Rmogo21,,2019-04-13 17:39:21
Our sunset From Silver Spring.,679,akgsnz,https://i.redd.it/mt96rpo1o1d21.jpg,29,1548657952.0,679,0,Culper1776,,2019-01-28 01:45:52
T-shirt design scares away potential tourist,680,dz77as,https://i.redd.it/m84tveosbvz31.jpg,36,1574307959.0,680,0,BrunetteBebe,,2019-11-20 22:45:59
I was at physical therapy this morning when some rando named Ryan showed up with a weird looking trophy,676,dwswee,https://i.redd.it/62axwy1yjvy31.jpg,36,1573863121.0,676,0,QuidYossarian,,2019-11-15 19:12:01
"Summer, 1935. Street kids at play, Georgetown, Washington D.C. My colorisation of original b&w photo by Carl Mydans.",678,8fa7mi,https://i.redd.it/3sm13lio1fu01.jpg,41,1524848389.0,678,0,EggsAckley,,2018-04-27 12:59:49
How are you guys not all dead?,682,80pwch,https://www.reddit.com/r/washingtondc/comments/80pwch/how_are_you_guys_not_all_dead/,303,1519792893.0,682,0,walkinghard,"Holy fuck. I just spent 45 min driving from Capitol Hill to College Park. I must've seen a hundred traffic violations.

In my entire time driving in Belgium (5 year) I've seen maybe 2 people texting and driving. Today I saw dozens of people doing it. On the fucking highway. A guy nearly hit my car while texting...I saw several people speeding on the fucking emergency lane, people not giving a shit about full white lines. Also, people here not know what turn signals are? I saw several people cutting people off with barely any space without even using their turn signal.

And holy fuck, a truck nearly hit me when switching lanes as I was next to him. Most scared I've been on the road like ever, he got so close.

Of all the states I've been (and I've been to Ohio) this has been my worst experience on the road by far. I saw a cop just chilling in his lane as a guy sped past him in the emergency lane in a beat up car. 

Why is it so bad here? Do you guys just not give a fuck? Why do so many people text and drive here? I swear, in Europe, it's soo uncommon. You get your license taken if they catch you doing that shit. 

Just had to rant about this. I was constantly raging at all these fucking morons on the road and I needed a release. :P 

Anyway, thanks hearing me out. Or if you're one of the aforementioned drivers - screw you!",2018-02-27 23:41:33
This Facebook post from a Federal Worker I know.,672,ajkh1d,https://i.redd.it/d94a8q1y2hc21.png,75,1548413056.0,672,0,Reine19,,2019-01-25 05:44:16
Video from a friend at The Blaguard last night - a little snowball fight with DCPD!,675,afjlm2,https://v.redd.it/fyfol0c967a21,58,1547417172.0,675,0,Tropical_Jesus,,2019-01-13 17:06:12
[MEME] Hitler Learns That OPM Won't Close on Friday,672,420p9c,https://youtu.be/3SemqaC3UdI,118,1453422292.0,672,0,Gumburcules,,2016-01-21 19:24:52
"Me, disappointed by the lack of rain and chance at a day off",671,9ftclb,https://i.redd.it/yax5xizwa8m11.jpg,48,1536970386.0,671,0,halfarab,,2018-09-14 20:13:06
Stay Safe- This guy randomly threw a huge rock at a woman near DuPont Circle this morning. When I confronted him he pulled something out of his bag and chased me. Seemed unwell. Police have information and are looking for him. Last seen heading up New Hampshire towards U Street.,669,bgv0dw,https://i.redd.it/ln8krpidy7u21.jpg,104,1556143484.0,669,0,mcpopnfresh,,2019-04-24 18:04:44
The Feds Didn't Pay Their $5 Million Water Bill. Can D.C. Shut Off Water To The White House?,676,adzh75,https://wamu.org/story/19/01/08/the-feds-didnt-pay-their-5-million-water-bill-can-d-c-shut-off-water-to-the-white-house/,66,1547013478.0,676,0,WAMU_885,,2019-01-09 00:57:58
Future Wife of a D.C. Attorney Starterpack,674,ableax,https://i.redd.it/0yl6vjl1rt721.png,87,1546401839.0,674,0,goopy-goo,,2019-01-01 23:03:59
"A very emotional scene inside Dulles airport this morning when an 11 y/o, held by ICE for 6+ months, reunited with his mother & grandmother. He claimed asylum at the border and was detained, yet the mom was already living legally in VA. She sued the Trump administration & won.",673,9iadm8,https://twitter.com/PatrickTorphy/status/1043478000472403969,70,1537754287.0,673,0,Bemuzed,,2018-09-23 21:58:07
Mario Metro Map,674,33ghmk,http://imgur.com/860NxXI,31,1429724252.0,674,0,shade1109,,2015-04-22 13:37:32
Tulips are out blooming around the Capitol,666,bbo5os,https://i.redd.it/oab66uixsgr21.jpg,4,1554943079.0,666,0,todd6739,,2019-04-10 20:37:59
"Charles Schumer says D.C. statehood is a priority, a first for Senate Democrats",671,ayqnla,https://www.washingtonpost.com/local/dc-politics/chuck-schumer-says-dc-statehood-is-a-priority-a-first-for-senate-democrats/2019/03/07/4b490ea2-4107-11e9-a0d3-1210e58a94cf_story.html?utm_term=.4bef0c7efc0d,206,1552082864.0,671,0,majortomsgroundcntrl,,2019-03-08 17:07:44
Monument last night,673,aop53x,https://i.imgur.com/rYvjvBb.jpg,12,1549716576.0,673,0,rjb4000,,2019-02-09 07:49:36
MAGA teens harass Indigenous People’s March attendees,672,ahmtcg,https://twitter.com/2020fight/status/1086476619877765120,90,1547939342.0,672,0,ElGuapo669,,2019-01-19 18:09:02
My moms ex boyfriend gave up our dog while she was away without her consent. He has been unwilling to give us the details of the family. We are heartbroken and desperately trying to find her before my younger brother and sister find out. Would it please be possible for you to share the flyer below?,665,dl5edo,https://i.redd.it/lcos4wu92yt31.jpg,55,1571714255.0,665,0,-starfruit-,,2019-10-21 23:17:35
My mom just got me these socks and I love them!!,668,ct0te5,https://i.redd.it/hjvke6q2imh31.jpg,22,1566344114.0,668,0,rljf311,,2019-08-20 19:35:14
DC Metro's Largest Union Refuses to Transport White Nationalists,671,94nhgo,http://fortune.com/2018/08/04/unite-the-right-rally-unions/,289,1533454553.0,671,0,addpulp,,2018-08-05 03:35:53
Nice view from the Lincoln Memorial this morning,667,8z21ps,https://i.redd.it/5vzz5agtf4a11.jpg,8,1531693432.0,667,0,Findingfoster,,2018-07-15 18:23:52
"Lincoln found hidden treasure under a log at the Arboretum. “Enjoy! In memory of Koa.” Sorry for your loss, stranger.",666,asdqv9,https://i.redd.it/qtqu1w1alkh21.jpg,25,1550630446.0,666,0,prwlr,,2019-02-19 21:40:46
Hidden gem at the US postal museum: the pistols used by Aaron Burr to kill Alexander Hamilton.,672,8rqoie,https://i.redd.it/nliunf8h0k411.jpg,66,1529266900.0,672,0,,,2018-06-17 16:21:40
"I thought I had a good view, but it probably doesn't compare to the pilot's.",670,8w71dp,https://i.redd.it/9xtr3anpj1811.jpg,29,1530786778.0,670,0,howlermouse,,2018-07-05 06:32:58
"""Khashoggi Way"" street sign at M and Wisconsin",665,aeylga,https://i.redd.it/7deph6zqcu921.jpg,43,1547261916.0,665,0,lint_goblin,,2019-01-11 21:58:36
House to vote on D.C. statehood for first time in 25 years,670,axb0e0,https://www.wusa9.com/article/news/local/dc/house-to-vote-on-dc-statehood-for-first-time-in-25-years/65-e1474edd-e181-47bf-80de-f69d4eabd6a4,255,1551755587.0,670,0,goodbetterbestbested,,2019-03-04 22:13:07
Most unrealistic thing from the alternate ending of T2: Judgement Day...repealing the Height Act,668,dybx1f,https://i.redd.it/ah84urwv8jz31.jpg,50,1574149964.0,668,0,Ueatsoap,,2019-11-19 02:52:44
All aboard to Branch Avenue,666,d93n5v,https://i.redd.it/pnr1nxzexqo31.jpg,24,1569448634.0,666,0,meilleurouvrierdfart,,2019-09-25 17:57:14
When you get out of the Cleveland Park metro during a flash flood.,665,4p7dmp,https://i.reddituploads.com/d3d37c85a19243a5b6d4432fa47da046?fit=max&h=1536&w=1536&s=575435c407bb158d774175545b9c222a,41,1466577051.0,665,0,shiskebob,,2016-06-22 02:30:51
I love taking pictures of the buildings in the city during a sunset,666,e15f9g,https://i.redd.it/fdz08xf4hp041.jpg,16,1574661238.0,666,0,whodoesntlovedogs,,2019-11-25 00:53:58
Google maps right now :),656,6gg726,https://i.redd.it/s483xwe6ku2z.jpg,24,1497141834.0,656,0,mansky,,2017-06-10 20:43:54
Godzilla sighting off of 9th St NW.,658,b2isgr,https://i.redd.it/503wknx1rvm21.jpg,25,1552944805.0,658,0,Julieafdaviss,,2019-03-18 17:33:25
Union Station tonight,660,a622zs,https://i.redd.it/3knphlfvn6421.jpg,39,1544795798.0,660,0,canyousaymaria,,2018-12-14 08:56:38
Look at this lightning we captured from tonights storm. WILD!,659,cg6l32,https://v.redd.it/i0t8ulvn7rb31,32,1563786070.0,659,0,smittyx5498,,2019-07-22 05:01:10
Let's Support Comet Ping Pong,659,5gt4mu,https://www.reddit.com/r/washingtondc/comments/5gt4mu/lets_support_comet_ping_pong/,162,1481063490.0,659,0,Duke_Paul,"I was reading [this article](https://www.washingtonpost.com/local/were-going-to-put-a-bullet-in-your-head-pizzagate-threats-terrorize-dc-shop-owners/2016/12/05/39469a82-bb2e-11e6-94ac-3d324840106c_story.html?utm_term=.e25a81b7380b) this morning (about how CPP, Terasol, and nearby vendors are losing business due to threats), and figured, if Reddit created this mess, then Reddit can fix it. So go to that talk at P&P. Stay for dinner. Play some ping pong. And prove that our city is bigger than zealots, xenophobes, and violent nutcases.",2016-12-06 17:31:30
Sunset at the DC United game last night,655,c66q9i,https://i.imgur.com/5oWBbSt.jpg,40,1561677271.0,655,0,defnotkev2,,2019-06-27 19:14:31
For the first time in my life its snowing before Thanksgiving!! :D I live in Park View,649,9xatdk,https://i.redd.it/lytjr626phy11.jpg,52,1542314324.0,649,0,justaladygingerneer,,2018-11-15 15:38:44
Fog over Freedom Plaza,658,7p78et,https://i.redd.it/zt3ute5ls1901.jpg,13,1515535028.0,658,0,CalebH92,,2018-01-09 16:57:08
Weather has been good so far in D.C.,652,bjbcnf,https://i.redd.it/8s1m3ud83iv21.jpg,39,1556702034.0,652,0,whodoesntlovedogs,,2019-05-01 05:13:54
Americana in Alexandria,656,8iem9g,https://i.redd.it/oaz116hvy0x01.jpg,66,1525985393.0,656,0,jbilous,,2018-05-10 16:49:53
On behalf of everyone,654,864406,https://imgur.com/tOum8Ck,24,1521683174.0,654,0,the_bagel_warmonger,,2018-03-21 21:46:14
I love this time of year.,651,5ferdo,https://i.redd.it/g60p1p5xsf0y.jpg,21,1480400981.0,651,0,AnonymousHillStaffer,,2016-11-29 01:29:41
RCN,649,c0jwhp,https://i.redd.it/ea85oexwmb431.jpg,57,1560546545.0,649,0,bobsacamano14,,2019-06-14 17:09:05
The Circles of DC,652,8q8zar,https://i.redd.it/tk0xd8nj3d311.png,43,1528747361.0,652,0,ptgorman,,2018-06-11 16:02:41
"I'm here, if you're furloughed/unemployed and need headshot, Busboy and Poets on 14th,",645,afb4f6,https://i.imgur.com/TK1xa0V.jpg,39,1547352724.0,645,0,findingmeno,,2019-01-12 23:12:04
Birthplace of /u/MarylandDriver,648,89jnhi,https://i.redd.it/cc7meg2bxrp01.jpg,22,1522824989.0,648,0,The_Lord_Humungus,,2018-04-04 02:56:29
"In 1944, Washington DC proposed to put its streetcars underground, long before there was a Metro system. I drew a map of the proposal.",655,an1lc3,https://i.imgur.com/Cel4hy8.jpg,37,1549315172.0,655,0,fiftythreestudio,,2019-02-04 16:19:32
