title,score,id,url,comms_num,created,ups,downs,author,body,timestamp
Every little bit counts,9190,5pcees,https://i.reddituploads.com/fa91b455743943a6bf57e25355a8ea36?fit=max&h=1536&w=1536&s=50974bb6573a7e452ba4f103ca9b69fc,1035,1485056177.0,9190,0,Mnislahi,,2017-01-21 22:36:17
This is how many people are at the Women's March on Washington right now,5787,5pbdhm,https://i.redd.it/4r0jhwibd3by.jpg,1103,1485044782.0,5787,0,BrianMKA,,2017-01-21 19:26:22
Just out for a little jog today before the hurricane hits.,2881,129vlt,http://i.imgur.com/bHtwi.jpg,334,1351547044.0,2881,0,HowtoJimmyK,,2012-10-29 17:44:04
We really live in a beautiful place.,2223,5e5nhz,https://i.redd.it/hfdeeuyqo0zx.jpg,46,1479782158.0,2223,0,AnonymousHillStaffer,,2016-11-21 21:35:58
Just watched this guy house a 2 liter bottle of dr pepper. Mondays.,1907,340x5o,http://imgur.com/B0baNHN,164,1430168319.0,1907,0,DCProducer,,2015-04-27 16:58:39
Posted near Potomac Avenue Metro station,1840,cth670,https://i.redd.it/1xh9hl9r4th31.jpg,31,1566424379.0,1840,0,ABC7NewsDC,,2019-08-21 17:52:59
"DC, let’s make this happen",1826,7k6tbd,https://i.redd.it/g7k4umgf5a401.jpg,164,1513456960.0,1826,0,captaincouscous,,2017-12-16 15:42:40
CAPITALS WIN THE STANLEY CUP!!!,1795,8pgi0d,https://www.reddit.com/r/washingtondc/comments/8pgi0d/capitals_win_the_stanley_cup/,125,1528455986.0,1795,0,PM_ME_UR_POLDERS,,2018-06-08 07:06:26
"Good Morning, DC!",1621,agkr5n,https://imgur.com/dTWJd3a,54,1547671250.0,1621,0,,,2019-01-16 15:40:50
So Joe Biden had this delivered to his house yesterday (check the license plate),1581,23uxvg,http://imgur.com/jlIOs08,126,1398376858.0,1581,0,AUBlazin,,2014-04-24 18:00:58
THE NATIONALS WON THE WORLD SERIES!,1578,dpi5c4,https://i.redd.it/1ug36x1ztsv31.jpg,106,1572522627.0,1578,0,KatzMwwow,,2019-10-31 07:50:27
It be like this,1516,dq3zlb,https://i.redd.it/iozikj08q2w31.png,99,1572642435.0,1516,0,Cat-In-The-Furnace,,2019-11-01 17:07:15
Got this shot of Ovi hoisting the cup at the parade,1469,8qt0uk,https://i.redd.it/ya3ublqm7s311.jpg,47,1528930352.0,1469,0,izokronus,,2018-06-13 18:52:32
Please add these to every station right at the bottom of all stairs. It’s more useful than any of your other upgrades. K thanks bye.,1440,a306ky,https://i.redd.it/5jvs1svk69221.jpg,116,1543954765.0,1440,0,,,2018-12-04 15:19:25
I noticed the MLB trophy fit really well in the Nats logo so I designed this fan art.,1442,drmu8k,https://i.redd.it/l94hto0g2qw31.png,48,1572925139.0,1442,0,jakevanyahres,,2019-11-04 22:38:59
I love flying this route into Reagan. Nothing like coming home to this.,1417,7fn30h,https://i.redd.it/eptl83bnub001.jpg,100,1511734159.0,1417,0,sideofsunny,,2017-11-26 17:09:19
Today I escorted nine ducklings down Pennsylvania Avenue,1406,19dmh8,http://imgur.com/a/IWdEM,97,1362055338.0,1406,0,propine,,2013-02-28 07:42:18
“We’re having a medical emergency.”,1396,cwk4v4,https://www.reddit.com/r/washingtondc/comments/cwk4v4/were_having_a_medical_emergency/,64,1567024183.0,1396,0,hungryhippopotanus,"This morning on the red line (glenmont) a woman had a seizure. As she was laying on the floor, everyone around me immediately jumped into action. 

The guy who had just been sitting across from me jumped up, hit the emergency button, and repeatedly said,  “we’re having a medical emergency.” 

A couple people next to the woman secured her bags and the person beside the woman held her head from the floor. Another woman immediately got on the phone with 911. 

The woman came too and seemed to realize what had happened to her. She was apologetic and we immediately told her this was way more important than our commute. 

She decided to get off at DuPont and a couple people helped with her bags and even walked her to a bench. 

We went from strangers on our phones to a small community helping out our commuter buddy. It was beautiful. 

Welp, back to lurking on Reddit.

EDIT # 1: the stories that I’ve read of people helping others, giving assistance, or wishing someone had helped them have touched me and others. I hope we continue to share things like this in this subreddit. I’ve read every single reply and here’s what I know...there is kindness and we are not alone.

EDIT # 2: The boyfriend of the young lady reached out and told me she’s doing fine!!",2019-08-28 16:29:43
Handmaid's Tale Filming Today at the Lincoln!,1384,aqyy20,https://i.redd.it/2wis73ezorg21.jpg,83,1550280595.0,1384,0,DiscoNachos,,2019-02-15 20:29:55
Even MLK was looking a little chilly this morning,1381,afyonz,https://i.redd.it/sumeor5tlfa21.jpg,38,1547519181.0,1381,0,WAMU_885,,2019-01-14 21:26:21
A pic I snapped earlier of the Costco parking lot mere hours before the 2 inch snowstorm hit DC.,1380,afdr0o,https://imgur.com/JSoTB5A,59,1547368495.0,1380,0,tipothehat,,2019-01-13 03:34:55
Repost from r/BlackPeopleTwitter. This sandwich looks delicious!!,1374,cxe7qa,https://i.redd.it/6tve4ualujj31.jpg,195,1567183695.0,1374,0,wishuwerentsoawkwbud,,2019-08-30 12:48:15
"Intersections of Washington, D.C.",1350,csfe6m,https://i.redd.it/58vdmk6bxdh31.png,139,1566240404.0,1350,0,ptgorman,,2019-08-19 14:46:44
"I happened across this scene on my way to the Georgetown waterfront. I wasn't looking for it, it found me. Not bad, shot with a Google phone.",1333,djcael,https://i.redd.it/gyfshqbbw5t31.jpg,53,1571373260.0,1333,0,jadium19,,2019-10-18 00:34:20
"If DC parking enforcement ever towed your car. Next time just park this.. The thing has been sitting in front of a fire hydrant for days. Anddon't let DCDPW ever tell you about public safety, it's all about towing money.",1326,4fym6i,http://i.imgur.com/THFlikL.jpg,314,1461363159.0,1326,0,Discoveryellow,,2016-04-22 18:12:39
I’ve embroidered the gorgeous DC sakura (also posted on Embroidery),1313,bd6skc,https://i.redd.it/59op0iifbas21.jpg,33,1555300393.0,1313,0,SandraValen,,2019-04-14 23:53:13
Yay DC airports,1296,ac0x7j,https://i.redd.it/owgivzzmq3821.jpg,98,1546511817.0,1296,0,sarumanspalantir,,2019-01-03 05:36:57
Blossoms at sunrise this morning before the rain.,1296,b7n73w,https://i.redd.it/6t9ewgta6gp21.jpg,22,1554063776.0,1296,0,rkdude02,,2019-03-31 16:22:56
"Gal Gadot stopped by the Inova Children’s Hospital in Annandale, Virginia on Friday in her Wonder Woman outfit.",1288,8x0xtw,https://i.redd.it/5v0kvipdjp811.jpg,95,1531079436.0,1288,0,empw,,2018-07-08 15:50:36
"If you’re hungry or homeless in Tenleytown/near AU, please message me. I’m a freshman with ~80 meal swipes left.",1263,a1s638,https://www.reddit.com/r/washingtondc/comments/a1s638/if_youre_hungry_or_homeless_in_tenleytownnear_au/,110,1543611200.0,1263,0,aufreshmanthrowaway,"Title pretty much says it. Finals are coming up so I won’t have a lot of time, but please hit me up. 

At the dining hall you can eat as much as you want, but there’s also a burger place, a salad place, a subway, and some other options.

Edit: Anonymous gilder, I appreciate it. But anyone else, please consider [donating](https://breadforthecity.org/donation/givetoday/) to Bread for The City instead.",2018-11-30 15:53:20
THE WASHINGTON NATIONALS ARE YOUR 2019 NATIONAL LEAGUE CHAMPIONS FOR THE FIRST TIME IN FRANCHISE HISTORY!!!!! FIRST WORLD SERIES IN THE NATION'S CAPITAL SINCE 1933!!!!!,1253,dij813,https://twitter.com/Nationals/status/1184305206252703744,89,1571224273.0,1253,0,JoseTwitterFan,,2019-10-16 07:11:13
Did some photography in DC tonight and this shot at Chinatown metro is one of my favorites,1248,c52z84,https://i.redd.it/ot63k4v2sf631.jpg,85,1561468398.0,1248,0,Rayven52,,2019-06-25 09:13:18
Finally got the right window seat for a DCA landing picture,1230,9upk76,https://i.redd.it/ci7kyr1wgqw11.jpg,57,1541548986.0,1230,0,Roleman44,,2018-11-06 19:03:06
Cherry Blossoms below the Capitol (OC),1232,b7sl13,https://i.redd.it/m39tmntuoip21.jpg,19,1554094217.0,1232,0,sooocahl,,2019-04-01 00:50:17
The things you see on the metro...,1216,amuz9b,https://i.redd.it/rrbvl2jukfe21.jpg,68,1549262220.0,1216,0,Moonpiexoxo,,2019-02-04 01:37:00
"Wholesome DC, Wholesome",1175,clqrdb,https://v.redd.it/s45539qxebe31,29,1564911733.0,1175,0,woodstock_16,,2019-08-04 05:42:13
NW DC Last Night,1168,azwioh,https://i.imgur.com/52qnmyW.jpg,15,1552356061.0,1168,0,TryAgainMyFriend,,2019-03-11 22:01:01
"Cava Will Give Its 1,600 Employees Paid Leave to Vote on Election Day",1167,9qfwor,https://www.washingtonian.com/2018/10/22/cava-will-give-its-1600-employees-paid-leave-to-vote-on-election-day/,71,1540257578.0,1167,0,irnbeau,,2018-10-22 21:19:38
"Visiting DC for the weekend, and feel so lucky to have a beautiful public space to kill time in without having to spend money to be here. Thanks for the warm hospitality!",1160,aw6yq4,https://i.redd.it/jj0wwvlfdjj21.jpg,104,1551487397.0,1160,0,DCIllini,,2019-03-01 19:43:17
THE WASHINGTON NATIONALS HAVE ADVANCED TO THE NATIONAL LEAGUE CHAMPIONSHIP SERIES FOR THE FIRST TIME EVER!!!,1155,dft6rj,https://www.washingtonpost.com/sports/2019/10/09/nationals-dodgers-nlds-game-five/,75,1570712666.0,1155,0,underDCskies,,2019-10-10 09:04:26
&pizza is on it,1156,avu8gs,https://i.imgur.com/8Y4jBlX.jpg,57,1551406460.0,1156,0,biffmcgregor,,2019-02-28 21:14:20
My plant survived the furlough!,1154,akpx50,https://i.redd.it/vxxaene0c7d21.jpg,44,1548726546.0,1154,0,DataBaker,,2019-01-28 20:49:06
Bald Eagle Over the Washington Monument,1153,ag0y92,https://i.redd.it/r5k1eyecnga21.jpg,65,1547531871.0,1153,0,jroc100,,2019-01-15 00:57:51
DC after midnight is the best! I took this photo a few hours ago 😊,1150,cb02sn,https://i.redd.it/w06l10x0s9931.jpg,85,1562703284.0,1150,0,angelwild327,,2019-07-09 16:14:44
I just have something in my eye...,1143,da1l12,https://i.redd.it/bex2hxqih5p31.jpg,20,1569625008.0,1143,0,maneezy94,,2019-09-27 18:56:48
This mornings view of the Jefferson Memorial across the Tidal Basin. 3/29/19 (OC),1139,b6x2t1,https://i.redd.it/z3w40acy42p21.jpg,27,1553893815.0,1139,0,sooocahl,,2019-03-29 17:10:15
Saw this while biking this morning,1135,dgh52l,https://i.redd.it/ixp7f210pxr31.jpg,17,1570838095.0,1135,0,jcdigg,,2019-10-11 19:54:55
Confession: I Airdrop this picture of my dog to everyone on the Red Line during my commute to and from work.,1117,chnd8g,https://i.redd.it/zp1beej17gc31.jpg,117,1564088525.0,1117,0,PMA1898,,2019-07-25 17:02:05
Springtime in Capitol Hill,1102,be98m2,https://i.redd.it/wj73nx4igus21.jpg,37,1555544236.0,1102,0,coffeenick,,2019-04-17 19:37:16
Just how I like my metro ride,1090,dcyk07,https://i.redd.it/ty0tdkfqmeq31.jpg,112,1570171460.0,1090,0,tacos_on_everycorner,,2019-10-04 02:44:20
"Happy snow day, Washington!",1095,afl9l5,https://i.redd.it/j132j61438a21.jpg,34,1547428116.0,1095,0,BrunetteBebe,,2019-01-13 20:08:36
Furloughed workers driving past the whitehouse on their way to work,1092,agxhxm,https://i.imgur.com/ldh0hPT.gif?1,161,1547758558.0,1092,0,proboardslolv5,,2019-01-17 15:55:58
Sunrise over the Capitol,1086,d7rh9n,https://i.redd.it/ljv7xn6vs5o31.jpg,18,1569192931.0,1086,0,Swarmin_Swedes,,2019-09-22 18:55:31
DC isn’t all bad,1086,d3qpjw,https://i.redd.it/2d93lqaiodm31.jpg,45,1568416558.0,1086,0,medievalrockstar,,2019-09-13 19:15:58
"I was lucky enough to catch this sunrise last Saturday, October 5",1075,dhib7d,https://i.redd.it/k84aj2p28es31.jpg,16,1571038225.0,1075,0,Hekma,,2019-10-14 03:30:25
@&pizza,1075,avluyi,https://gfycat.com/ThirstyRectangularEel,89,1551350430.0,1075,0,petitcastor92,,2019-02-28 05:40:30
"In the WaPo obituaries: “A native of Northern VA for the last 30 years of his life, he hated how all of you were incapable of driving competently.”",1069,8mmb7c,https://i.imgur.com/ZkXxRZ0.jpg,76,1527498922.0,1069,0,iswearitsreallyme,,2018-05-28 05:15:22
This made me chuckle at my work desk,1064,9eybrf,https://i.redd.it/xgrdk493gml11.jpg,11,1536706982.0,1064,0,rytis,,2018-09-11 19:03:02
"Saw these on my way to work, they’re all over Capital Hill 😂",1069,8a9kcv,https://i.redd.it/9xg5z55ekaq01.jpg,239,1523050714.0,1069,0,SheWhoErases86,,2018-04-06 17:38:34
"They cant shut down the steps of a monument, can they?",1056,aalhje,https://imgur.com/ocGXTBg,21,1546121467.0,1056,0,alh9h,,2018-12-29 17:11:07
Giant Christmas wreaths are back up at Union Station,1057,a095b6,https://i.redd.it/g7b5nqnmsh021.jpg,20,1543187178.0,1057,0,todd6739,,2018-11-25 18:06:18
View of DC from the Capitol rotunda balcony.,1055,arc76z,https://i.redd.it/x1ogw7ltgzg21.jpg,43,1550374701.0,1055,0,onlywayunderway,,2019-02-16 22:38:21
Metro changes explained by a customer with a pen,1036,701sru,https://i.imgur.com/ze0P5Hj.jpg,72,1505419780.0,1036,0,sisyphushaditsoeasy,,2017-09-14 16:09:40
My son is going as the Metro this year.,1036,5af8ro,https://i.reddituploads.com/72c3e19af50e4b49bb4231f167e5a41d?fit=max&h=1536&w=1536&s=ebea4c5118c6f9af1edce094ef599c49,28,1477979306.0,1036,0,s7ryph,,2016-11-01 01:48:26
Last weekend to see sunset views from the top. Awesome experience,1023,daw830,https://i.redd.it/u4kni1tbsjp31.jpg,32,1569798022.0,1023,0,Rucca_v,,2019-09-29 19:00:22
ATTENTION WASHINGTON DC: Tomorrow I am running a ALL DAY Taco Bell delivery service for a $5 flat rate per run,1023,1xrlp4,https://www.reddit.com/r/washingtondc/comments/1xrlp4/attention_washington_dc_tomorrow_i_am_running_a/,200,1392287365.0,1023,0,JoeCamel420,"OK redditors, so my dealership is full of assholes who won't let me get the 50k maintenance on my truck until I rack up another few hundred miles, so I'll be taking orders starting 10 AM tomorrow and I'll go anywhere within the DC metro area (except like really far like baltimore or herndon or waldorf or whatever) to deliver Taco Bell right to your door - so no matter how snowed in, drunk, or stoned you are while you're celebrating the snowday, I'll make sure you get your tacos. I'm only asking $5 per drive (although I'll happy to accept additional tips and/or cigarettes). I'll update tomorrow with a number and a little bit more info. Stay safe tomorrow folks!

Edit: holy christ I picked the wrong week to quit drinking. All right, There's like 2 feet feet of snow on the ground so after I dig my truck back out of the snow, I'll figure out how to handle the logistics of getting these tacos where they need to go 

EDIT: OK EVERYBODYYYYY IM GOING TO GO TO TACO BELL AND literally, I am going to clean out the place for all the tacos they have. I'm going to the Hyattsville taco bell first and I'm literally going to buy every taco I canm and I guess afterwards I'll open up to PMs, starting with college park I guess. PEACE

edit: OK I'm re upping on tacos in about 1 hour at the one on 14th street. If you're downtown, PM me now so I don't end up with 500 extra tacos tonight ",2014-02-13 05:29:25
Caught a pic of the rainbow over the Washington Monument while the sun set tonight,1017,4de9ab,http://imgur.com/ChU5Xbc,27,1459848800.0,1017,0,discounttoasteroven,,2016-04-05 05:33:20
BREAKING: Multiple sources tell News4 Metro will shut down entirely tomorrow (Wednesday) for safety checks.,1018,4ak599,https://twitter.com/AdamTuss/status/709829993711316992,525,1458100627.0,1018,0,MELBOT87,,2016-03-15 23:57:07
DC Statehood!,1012,426ijb,http://i.imgur.com/lIwq92I.jpg,43,1453512034.0,1012,0,thomble,,2016-01-22 20:20:34
People like this are the heart of DC. The crooked politicians do not define us.,1013,amef39,https://v.redd.it/ljjsnx1sr3e21,64,1549145802.0,1013,0,CapsAndSkinsFan08,,2019-02-02 17:16:42
See You Again Next Year!,1003,8qmzub,https://i.redd.it/s714z5695n311.jpg,27,1528868988.0,1003,0,HBScott1961,,2018-06-13 01:49:48
I'll just leave this here,996,c918s1,https://i.redd.it/n15vxmflp9831.jpg,27,1562266617.0,996,0,GreyJediGuy,,2019-07-04 14:56:57
Saw this guy on the metro,995,ci5btl,https://i.redd.it/r6hukjsrgoc31.jpg,75,1564188647.0,995,0,Rhaegar,,2019-07-26 20:50:47
This was in my inbox this morning,992,64rff6,http://i.imgur.com/bzgtJN8.png,37,1491952447.0,992,0,br00kland,,2017-04-11 19:14:07
Greetings from L Street.,988,5q3smy,http://imgur.com/7kfPGid,190,1485387111.0,988,0,0909a0909,,2017-01-25 18:31:51
"View from above of just part of the crowd yesterday. World series champs looks good on ya, DC",992,dr222m,https://i.redd.it/9xnlqtgirhw31.jpg,35,1572824471.0,992,0,AnyDamnVegetables,,2019-11-03 18:41:11
President Underwood rides the metro,982,6cqw5l,https://i.redd.it/xw63l7n5y4zy.jpg,65,1495524226.0,982,0,ParadoxDC,,2017-05-23 03:23:46
"A complication from last night, if you have the chance to go to this please do it. No photo or video does justice",984,cfpmqb,https://i.redd.it/yyipcqjvcib31.jpg,73,1563678911.0,984,0,morgichor,,2019-07-20 23:15:11
CAPS WIN GAME 4 UPVOTE THREAD,977,8onfu3,https://www.reddit.com/r/washingtondc/comments/8onfu3/caps_win_game_4_upvote_thread/,70,1528196474.0,977,0,RVA_101,"GLORY TO OSHIE

GLORY TO 5 ON 3 POWER PLAYS

GLORY TO THE CAPS",2018-06-05 07:01:14
Ben’s Chilli Bowl and summer vibes.,976,8p4p2b,https://i.redd.it/mdm7w2w9bg211.jpg,62,1528350405.0,976,0,whodoesntlovedogs,,2018-06-07 01:46:45
US Botanic Garden is one of favorite spots in the city.,976,bi1kv0,https://i.redd.it/t1qtnxgiguu21.jpg,42,1556415943.0,976,0,whodoesntlovedogs,,2019-04-27 21:45:43
Not your average Cherry Blossom pic,974,b8x5h5,https://i.redd.it/ymyu11o3j1q21.jpg,35,1554322326.0,974,0,DumasThePharaoh,,2019-04-03 16:12:06
Photo: Four seasons of Logan Circle [OC],973,ckp7x1,https://i.redd.it/eos2ggudmud31.jpg,18,1564699122.0,973,0,jojobanks1981,,2019-08-01 18:38:42
A couple takes a break during the 1941 cherry blossom festival. My colorization of b&w original.,975,bafqib,https://i.redd.it/v5y117a35uq21.jpg,65,1554668730.0,975,0,EggsAckley,,2019-04-07 16:25:30
The intersection of 13th and N right now,972,cvg05j,https://i.imgur.com/U4BDbu6.jpg,232,1566804619.0,972,0,jershnotjosh,,2019-08-26 03:30:19
"My view from my apartment just before the storm last night. Took maybe 50 photos, but the timing was just right on the very first one!",963,8jvnrw,https://i.redd.it/hsx6ozx7h8y01.jpg,32,1526512162.0,963,0,dpmooney0414,,2018-05-16 19:09:22
The C&O Canal in Georgetown,965,btrndu,https://i.redd.it/5emtv9gtnt031.jpg,36,1559021413.0,965,0,sdkb,,2019-05-28 01:30:13
"I've lived here 7 years and finally woke up early enough to watch the sunrise from the Lincoln Memorial, I highly recommend it.",960,9f9oda,https://i.redd.it/nlqtp3fnbul11.jpg,25,1536801211.0,960,0,GodverdommeCoffee,,2018-09-12 21:13:31
I love this map of DC,965,9b8m4z,https://upload.wikimedia.org/wikipedia/commons/9/93/DC_neighborhoods_map.png,212,1535572575.0,965,0,,,2018-08-29 15:56:15
Silver lining with the shutdown,959,7s5210,https://i.redd.it/q4z5ezsmplb01.jpg,72,1516647867.0,959,0,flyboy2123,,2018-01-22 14:04:27
Let's not forget the original DC food meme -- the ice cream guy.,955,avywx6,https://i.redd.it/d5myyv7wvej21.jpg,40,1551433089.0,955,0,chyaos,,2019-03-01 04:38:09
So there was a mfing BALD EAGLE just chilling in my alley this morning...,946,dmmc7t,https://i.imgur.com/pMhEp8v.jpg,51,1571978090.0,946,0,radagasthebrown,,2019-10-25 00:34:50
"Back in May, my buddy put $100 on the Nats to win it all at 60-1 odds. Charlestown sportsbook got raked!",953,dps5dh,https://i.redd.it/8l2i4v9fcxv31.jpg,88,1572577259.0,953,0,megalithicman,,2019-10-31 23:00:59
"Woke up bright and early to take this shot, thought you all would enjoy! ""Trafficless DC""",948,7xzmki,https://i.redd.it/902zx9ypjlg01.jpg,59,1518825296.0,948,0,jameslewismertz,,2018-02-16 18:54:56
My personal favorite DC plate.,949,b0dm8x,https://i.redd.it/zlfcgvbderl21.jpg,43,1552456261.0,949,0,scuba_kai,,2019-03-13 01:51:01
Shout out to Ryan!,939,cqycgz,https://i.redd.it/6paa38picpg31.png,39,1565942717.0,939,0,gray_host,,2019-08-16 04:05:17
I think I’ve figured out Trump’s strategy,943,af7994,https://i.redd.it/f31saetrrz921.jpg,25,1547327446.0,943,0,,,2019-01-12 16:10:46
It Is Known,938,asqtb6,https://i.redd.it/ve2e5umw9rh21.jpg,187,1550711415.0,938,0,TrueVCU,,2019-02-20 20:10:15
Sunrise this morning from a frozen reflecting pool [OC],931,ak1dip,https://i.redd.it/cxueoo6m4sc21.jpg,12,1548542486.0,931,0,someguy9,,2019-01-26 17:41:26
"So, I went up to the roof of the Watergate for a drink.",940,57yfdn,https://i.redd.it/9bwfh66sf2sx.jpg,37,1476752399.0,940,0,DrJackGriffin,,2016-10-17 20:59:59
Best part of flying into DCA,935,8hgk26,https://i.redd.it/jw7mjnj3o9w01.jpg,101,1525654885.0,935,0,Carcetti_4_Mayor,,2018-05-06 21:01:25
Sunrise over the cherry blossoms,928,b9s5d2,https://i.redd.it/b9233lmhlgq21.jpg,41,1554504720.0,928,0,Rucca_v,,2019-04-05 18:52:00
Caught one last sunrise before moving out of DC,928,9njx9r,https://i.redd.it/xo9935nj2rr11.jpg,27,1539376843.0,928,0,OnARoadLessTaken,,2018-10-12 16:40:43
"Seriously: fuck you no lights on, not cleaned off, driving 60 mph, mother fuckers.",927,afv47x,https://www.reddit.com/r/washingtondc/comments/afv47x/seriously_fuck_you_no_lights_on_not_cleaned_off/,211,1547495792.0,927,0,fuckyoumartinez,What is wrong with you?! ,2019-01-14 14:56:32
Metro testing out I-95 North service.,932,a2r0ox,https://i.redd.it/7498oae0p3221.jpg,36,1543888161.0,932,0,dekitchen,,2018-12-03 20:49:21
The view of the March For Our Lives from the Newseum,925,86w5vx,https://v.redd.it/ht1yvgf05sn01,160,1521955924.0,925,0,WAMU_885,,2018-03-25 01:32:04
"Today I saw hundreds of high school students come together to protest guns. No matter what your view on this issue is, it was so incredibly heartwarming to see these young ppl stand up for what they believe in!",924,84fa1b,https://i.redd.it/6b0d7pg5mrl01.jpg,224,1521077820.0,924,0,chattyfloof,,2018-03-14 21:37:00
We need this system,921,c5omd4,https://i.redd.it/rgs29ommik631.jpg,80,1561576926.0,921,0,rangisrovus19,,2019-06-26 15:22:06
Yesterday’s rainbow stretching from DC to VA,918,c3boof,https://i.redd.it/8dt1rrnr5q531.jpg,22,1561158224.0,918,0,laviddincoln,,2019-06-21 19:03:44
Cherry Blossom Metro cards are out at Union Station!,919,b13ssa,https://imgur.com/VCXKh8t.jpg,63,1552616547.0,919,0,Hemansno1fan,,2019-03-14 22:22:27
Halloween in DC,917,9rk70q,https://i.redd.it/kfkisuosuiu11.jpg,95,1540584927.0,917,0,conbel,,2018-10-26 16:15:27
Oh DC...,916,88wb6j,https://i.redd.it/82ap9tuxuep01.jpg,68,1522666818.0,916,0,vikramdesh1,,2018-04-02 07:00:18
My submission for the new Metro Logo,912,80ysd4,https://i.redd.it/y7yn0qct80j01.png,41,1519874762.0,912,0,OmniaMors,,2018-02-28 22:26:02
DC Maths,909,3jhi8b,http://i.imgur.com/JRaNgB2.png,157,1441315782.0,909,0,mosqua,,2015-09-03 17:29:42
"NBA champion Warriors skip meeting Trump, met with Obama during DC visit instead",912,ajpjeq,http://www.fox5dc.com/news/nba-champion-warriors-skip-meeting-trump-met-with-obama-during-dc-visit-instead,72,1548455343.0,912,0,fox5dcnews,,2019-01-25 17:29:03
Man reading the newspaper under the cherry blossoms,909,8aq7lp,https://i.redd.it/gq1fntsp1pq01.jpg,35,1523226093.0,909,0,ShodyLoko,,2018-04-08 18:21:33
Washington Mystics win WNBA title,907,dg8boe,https://www.reddit.com/r/washingtondc/comments/dg8boe/washington_mystics_win_wnba_title/,43,1570788055.0,907,0,BigDCSportsFan,Congrats!,2019-10-11 06:00:55
Washington Metro: Map vs. Geographic Scale [OC] [xpost /r/dataisbeautiful],912,6cgxi6,https://i.redd.it/rfnfxzpuavyy.gif,124,1495407448.0,912,0,stupidgit,,2017-05-21 18:57:28
3 Hour Time Lapse Composite of Reagan National Airport from Gravelly Point Park [x-post from r/NoVa],903,2zlfqp,http://imgur.com/6czv1gU,70,1426808929.0,903,0,hrmiracle,,2015-03-19 19:48:49
“Metro Carpet”. Mixed media on carpet. 2019.,904,cxlkta,https://i.redd.it/mo41hapmzmj31.jpg,51,1567221713.0,904,0,carmonamedina,,2019-08-30 23:21:53
D.C. at night photographed from the International Space Station,904,be8dwo,https://eol.jsc.nasa.gov/DatabaseImages/ESC/large/ISS026/ISS026-E-10847.JPG,46,1555539728.0,904,0,RyanSmith,,2019-04-17 18:22:08
This morning on the Tidal Basin (OC),902,ba41o5,https://i.redd.it/3ys0qpr46nq21.jpg,7,1554584306.0,902,0,sooocahl,,2019-04-06 16:58:26
Do they ever get what they want?,900,aj2hnl,https://i.redd.it/48bbvegxp7c21.jpg,155,1548295458.0,900,0,Avenger772,,2019-01-23 21:04:18
A small thank you...,901,9p9ja4,https://www.reddit.com/r/washingtondc/comments/9p9ja4/a_small_thank_you/,52,1539900106.0,901,0,frankinthecoil,"To the man in the Rite Aid at Rosslyn station who told the middle aged woman, who saw me buying a pregnancy test, to shut the f*** up after she made a comment about me possibly being pregnant and unwed. 

Thank you for asking where I was going to make sure in my fit of crying I got on the bus to work safely. 

Thank you 💕",2018-10-18 18:01:46
"Capital Lounge is doing Shutdown Cocktails, every day of the week during the government shutdown!",894,a8loaf,https://i.redd.it/7reern63mu521.jpg,50,1545521614.0,894,0,OnARoadLessTaken,,2018-12-22 18:33:34
Took this two years ago on my way home from work.,897,a2e1vn,https://i.redd.it/th2nhk1cuv121.jpg,27,1543793117.0,897,0,cat_drool,,2018-12-02 18:25:17
The Donald J. Trump Presidential Tweet Library is going up (14th and L St. NW),900,bzeym5,https://i.redd.it/y2ky1ayqbr331.jpg,49,1560300826.0,900,0,rubbersidedown20,,2019-06-11 20:53:46
Trump Admin is Desperate for help,890,a4yjku,https://i.redd.it/m0kf6bpczh321.jpg,34,1544496984.0,890,0,hushpuppylife,,2018-12-10 21:56:24
Thanks Princess Elsa. DC thanks you.,886,42hci0,http://i.imgur.com/Fz7p69i.jpg,26,1453693340.0,886,0,killerasp,,2016-01-24 22:42:20
First time I've ever seen a Metro train covered in graffiti,885,b0ki71,https://i.redd.it/l8ggxx108vl21.jpg,171,1552502547.0,885,0,TrueBirch,,2019-03-13 14:42:27
The Awakening Is Under Water!!,881,8klw8q,https://i.redd.it/kxear71wxty01.jpg,42,1526772005.0,881,0,AllenOneDC,,2018-05-19 19:20:05
Lost in DC. Please help.,886,4aaxgd,https://www.reddit.com/r/washingtondc/comments/4aaxgd/lost_in_dc_please_help/,284,1457945801.0,886,0,3XLtheDJ,"We lost our car in a parking garage in dc near the convention center. This statue is the only thing we have to go on. It's in the building connected to our parking garage. http://i.imgur.com/GZLAFsO.jpg

Edit: /u/Largewill is a lifesaver. We are on our way out of DC now. Thanks everyone.",2016-03-14 04:56:41
